timestamp,text,type,id,author,is_deleted,submission_id,submission_title,parent_id,score,controversiality,gilded,author_flair_text,link_flair_text,is_self,url,domain
1611575376,"[the first image, if you wanted to see it](https://i.4cdn.org/lgbt/1611543472945.png)",comment,gkp5ozt,Fentanya,0,l4mcfl,,t3_l4mcfl,2,0,0,Queen of this subreddit,,,,
1611589905,[deleted],comment,gkpuh9r,[deleted],1,l4mdsr,,t3_l4mdsr,7,0,0,,,,,
1611591076,LMAOOO thank you for making me laugh,comment,gkpxaqw,Fentanya,0,l4mdsr,,t1_gkpuh9r,4,0,0,Queen of this subreddit,,,,
1611600548,Now they know the ftm struggle,comment,gkqjevq,[deleted],0,l4rx83,,t3_l4rx83,11,0,0,,,,,
1611613534,"~~god I wish that were me~~

yes I'm a seething tranny, what are you gonna do? reply with a wojak caricature?",comment,gkrc2aq,wednesday--,0,l4rx83,,t3_l4rx83,13,0,0,boysmell connoisseur,,,,
1611624480,What the fuck is /TTTT/'s obsession with diapers,comment,gkrxcmd,Meatcircus23,0,k6ptgu,,t3_k6ptgu,1,0,0,,,,,
1611638133,"I mean, aren't we all in the same boat.",comment,gkslvpq,FiveFiveOneTwo,0,l4rx83,,t1_gkrc2aq,3,0,0,,,,,
1611638290,[removed],comment,gksm44a,[deleted],1,l4rx83,,t3_l4rx83,10,0,0,,,,,
1611639972," fundamental constants of the universe:

1. the speed of light

2. Planck's constant

3. Newton's gravitational constant

4. trannies seething that femboys pass better than them",comment,gksoirj,wednesday--,0,l4rx83,,t1_gkslvpq,7,0,0,boysmell connoisseur,,,,
1611645782,Hmm.... I used to lash out whenever people called me a girl. I guess I really am a man.,comment,gksvn6b,[deleted],0,l4rx83,,t1_gksm44a,1,0,0,,,,,
1611670088,"Nah but you know, empathy for our poor little cissies only! Trannies deserve whatever pain they get for being freaks of nature.",comment,gktoey6,[deleted],0,l5e4oj,,t3_l5e4oj,10,0,0,,,,,
1611670273,Literally 99% of chasers will transition. I don't understand why he's so hung up on that when he knows that being a transbian is an option. GAMPs literally score higher on AGP than control anyways.,comment,gktor6r,[deleted],0,l5d756,,t3_l5d756,3,0,0,,,,,
1611672611,squid with the correct take again,comment,gkttf1f,yosh_yosh_yosh_yosh,0,l5d756,,t3_l5d756,5,0,0,,,,,
1611677084,"Trannies are not mammals. We reproduce by ""laying eggs"".",comment,gku37cx,Fentanya,0,l5d756,,t1_gktor6r,3,0,0,Queen of this subreddit,,,,
1611677316,How do I do that,comment,gku3q1u,[deleted],0,l5d756,,t1_gku37cx,1,0,0,,,,,
1611677820,"If your feminine beauty alone isn't enough to make the chaser jealous, try forced feminizing and sissifying him as part of your sex with him. Awaken the sleeping dragon that is his repressed autogynephilic tendencies.",comment,gku4v3l,Fentanya,0,l5d756,,t1_gku3q1u,5,0,0,Queen of this subreddit,,,,
1611678869,I'd prefer to just castrate them so they have no choice.,comment,gku784l,[deleted],0,l5d756,,t1_gku4v3l,6,0,0,,,,,
1611679143,based,comment,gku7uiv,yosh_yosh_yosh_yosh,0,l5d756,,t1_gku784l,1,0,0,,,,,
1611679253,Eunuchs live longer than normal men. You're doing them a favor.,comment,gku83mn,Fentanya,0,l5d756,,t1_gku784l,5,0,0,Queen of this subreddit,,,,
1611679557,Hey dad can you pay for my orchiectomy? No not to become a cum dump I just want to live longer.,comment,gku8svm,[deleted],0,l5d756,,t1_gku83mn,7,0,0,,,,,
1611679847,it is one of the cheapest transition-related surgeries. You can probably afford it sooner than you think.,comment,gku9h1a,Fentanya,0,l5d756,,t1_gku8svm,6,0,0,Queen of this subreddit,,,,
1611680065,"Once I turn 18 I can get it covered by insurance anyways, just been thinking about it recently because I'm kinda jealous at my friend from Oregon who got it covered and she's around my age.",comment,gku9z6r,[deleted],0,l5d756,,t1_gku9h1a,3,0,0,,,,,
1611687892,[removed],comment,gkusumy,[deleted],1,l5e4oj,,t3_l5e4oj,6,0,0,,,,,
1611689201,[removed],comment,gkuvzrf,[deleted],1,l5czxd,,t3_l5czxd,4,0,0,,,,,
1611704680,"I mean.... To most people probably not being a crazy misandrist transbian who wants to change other people's sexuality?

That literally describes me but I know I'm not normal.",comment,gkvwm1c,[deleted],0,l3nxnk,,t1_gkifbhe,1,0,0,,,,,
1611715806,unstoppable force meets immovable object,comment,gkwjbt5,im--stuff,0,l3nxnk,,t3_l3nxnk,3,0,0,,,,,
1611726676,holy shit,comment,gkx29yf,theripoffartist,0,l5ql6o,,t3_l5ql6o,4,0,0,AGP BDD ABCDEFGH,,,,
1611732411,"ahhh discord bf :3

lemme add that to my list of imaginary bfs, along with japanese-exchange-student bf and /fit/-guy-i-meet-at-the-gym bf",comment,gkx9tbx,wednesday--,0,l5ul74,,t3_l5ul74,8,0,0,boysmell connoisseur,,,,
1611742959,**pain**,comment,gkxln6p,Year_2038_Problem,0,l5zlf8,,t3_l5zlf8,25,0,0,,,,,
1611744030,"Almost had me there!

Seriously is it too much to ask for a bf that does this xD",comment,gkxmvok,mosquitoiv,0,l5zlf8,,t3_l5zlf8,22,0,0,edit this,,,,
1611760545,"I just realized headphones has the word ""hon"" in it",comment,gkyfbx8,Fentanya,0,l5zlf8,,t3_l5zlf8,16,0,0,Queen of this subreddit,,,,
1611762604,[removed],comment,gkyl2it,[deleted],1,l5zlf8,,t3_l5zlf8,6,0,0,,,,,
1611777192,Literally shaking and crying,comment,gkzozaj,Crit-Monkey,0,l5zlf8,,t1_gkyfbx8,13,0,0,,,,,
1611803343,q? is that you?,comment,gl1i487,QueenOfTransStyle,0,l5ql6o,,t3_l5ql6o,6,0,0,,,,,
1611809463,i literally cannot comprehend a word of this,comment,gl1u4dd,Nova_of_Arcturus,0,l6nyc1,,t3_l6nyc1,7,0,0,,,,,
1611809675,good,comment,gl1ui36,Fentanya,0,l6nyc1,,t1_gl1u4dd,5,0,0,Queen of this subreddit,,,,
1611811415,aight time to suppress,comment,gl1xjvw,Nova_of_Arcturus,0,l6nyc1,,t1_gl1ui36,4,0,0,,,,,
1611812430,could transitioning have saved him?,comment,gl1z8sx,Juuliyuh,0,l6oet6,,t3_l6oet6,19,0,0,racist femboy,,,,
1611813103,this is extremely alleged,comment,gl20bz0,yosh_yosh_yosh_yosh,0,l6nyc1,,t3_l6nyc1,5,0,0,,,,,
1611814341,Lol even if it was true the UK media wouldn't publish it cause they hate tranners so much,comment,gl229et,ACutleryChristmas,0,l6nyc1,,t3_l6nyc1,13,0,0,,,,,
1611865087,I am mostly responsible for bringing this cancer to r/transgendercirclejerk,comment,gl51xaq,Fentanya,0,l759aj,,t3_l759aj,9,0,0,Queen of this subreddit,,,,
1611869744,Browsed the board since it first started. Before it became /tttt/. It’s at an all time low these days. Half the threads are people rehashing the same old arguments with gincel or unchaser,comment,gl5f17b,Kalvin-TL,0,l759aj,,t3_l759aj,3,0,0,,,,,
1611872730,"wait when i said i didnt hear take your pills alice from you i didnt realize you ran this sub

/rj this goes to show the stupidity of idiots like me",comment,gl5n065,JenOnAPlane,0,l759aj,,t1_gl51xaq,4,0,0,,,,,
1611906214,welcome to hell. you will never leave.,comment,gl7keka,theripoffartist,0,l759aj,,t3_l759aj,1,0,0,AGP BDD ABCDEFGH,,,,
1611942021,"I assume literally every story that gets posted here is fake, but if it wasn’t, holy shit I'd feel so fucking bad for these people",comment,gl9hswg,n0t_me_irl,0,l5hzn0,,t3_l5hzn0,6,0,0,,,,,
1611958813,my head hurt reading that,comment,glasez4,theripoffartist,0,l7y81v,,t3_l7y81v,4,0,0,AGP BDD ABCDEFGH,,,,
1611959380,if this place ever gets decently large it might be good to expand it,comment,glatotf,yosh_yosh_yosh_yosh,0,l80g0w,,t3_l80g0w,6,0,0,,,,,
1611961199,There's already a bunch of groups for general trans shitposting.,comment,glaxsrl,mosquitoiv,0,l80g0w,,t3_l80g0w,4,0,0,edit this,,,,
1611963491,"yes, but most of them don’t allow slurs and other shit that I do in my own sub",comment,glb2w04,Fentanya,0,l80g0w,,t1_glaxsrl,4,0,0,Queen of this subreddit,,,,
1611988420,I was banned from tgcj for autogyneposting. But in this sub? That shit is encouraged!,comment,glcdwca,Fentanya,0,l8ac8h,,t3_l8ac8h,11,0,0,Queen of this subreddit,,,,
1612002889,[deleted],comment,glctwc3,[deleted],1,l80g0w,,t3_l80g0w,1,0,0,,,,,
1612039435,They knew,comment,glem3fr,Juuliyuh,0,l8tzol,,t3_l8tzol,14,0,0,racist femboy,,,,
1612039866,we always know,comment,glemzym,theripoffartist,0,l8tzol,,t1_glem3fr,11,0,0,AGP BDD ABCDEFGH,,,,
1612047845,I mean it was lowkey not hard to see it coming tbh,comment,glf3cu0,Pm_me_trans_goals,0,l8tzol,,t3_l8tzol,10,0,0,,,,,
1612047883,"No shit, so easy to clock this boymoder.",comment,glf3fjt,[deleted],0,l8tzol,,t3_l8tzol,21,0,0,,,,,
1612052001,"""it's just a lockdown haircut""

""they're a professional actor, so of course they have nice eyebrows and soft skin""

""oh they're just cross dressing because they were cast for a cross-gender role""

tttt knew all along and I was coping trying not to believe it &gt;. &lt;

wish the best for her",comment,glfbfge,wednesday--,0,l8tzol,,t3_l8tzol,16,0,0,boysmell connoisseur,,,,
1612054051,I forgot I was reading a 4chan post and the g’night anon sent me,comment,glfffwf,KrillBosby,0,l5zlf8,,t3_l5zlf8,11,0,0,,,,,
1612054648,Was this after its birth?,comment,glfgl6z,KrillBosby,0,l48s2y,,t1_gko2edr,2,0,0,,,,,
1612056312,[removed],comment,glfjqoi,[deleted],1,l48s2y,,t1_glfgl6z,3,0,0,,,,,
1612056392,[deleted],comment,glfjw55,[deleted],1,l8tzol,,t3_l8tzol,5,0,0,,,,,
1612056850,"""She just looks like she probably does that"" is how the wokescolds and truscum and wokescold truscum always try to come after her",comment,glfkrua,Weekly-Shake8740,0,l7y81v,,t3_l7y81v,1,0,0,,,,,
1612059037,she's an academic. have you ever met a white academic that wasn't racist?,comment,glfowqy,scorchdearth,0,l7y81v,,t3_l7y81v,4,0,0,,,,,
1612059096,I don't really care either way but I'd like to see the poll results,comment,glfp0p9,scorchdearth,0,l80g0w,,t1_glb2w04,2,0,0,,,,,
1612060423,Really tho?,comment,glfrj1t,KrillBosby,0,kvhrs6,,t1_gkgyl0q,1,0,0,,,,,
1612060501,I can send you a study but I'm too fucking lazy to do that.,comment,glfrodg,[deleted],0,kvhrs6,,t1_glfrj1t,3,0,0,,,,,
1612060771,Also this isn't a great place to be as a young trans person who's just starting out tbh.,comment,glfs726,[deleted],0,kvhrs6,,t1_glfrj1t,1,0,0,,,,,
1612065373,Eh idc lol,comment,glg0x34,KrillBosby,0,kvhrs6,,t1_glfs726,1,0,0,,,,,
1612075241,Yeah and in a few months you'll be miserable and fail all your classes like me lol.,comment,glggia6,[deleted],0,kvhrs6,,t1_glg0x34,1,0,0,,,,,
1612103337,William Shakespeare when somebody says they're going to go to bed soon,comment,glhd0t2,SongOTheGolgiBoatmen,0,l5zlf8,,t1_glfffwf,6,0,0,,,,,
1612104263,Re-living past trauma?,comment,glhelqy,SongOTheGolgiBoatmen,0,kvhrs6,,t1_gj2a3ve,2,0,0,,,,,
1612107104,[deleted],comment,glhjfxb,[deleted],1,l80g0w,,t3_l80g0w,1,0,0,,,,,
1612109335,I already went through that checkmate libtard 😎,comment,glhnvfr,KrillBosby,0,kvhrs6,,t1_glggia6,1,0,0,,,,,
1612110982,[deleted],comment,glhr96e,[deleted],1,l80g0w,,t1_glhjfxb,1,0,0,,,,,
1612122306,... yes,comment,glifysv,yosh_yosh_yosh_yosh,0,l7y81v,,t1_glfowqy,6,0,0,,,,,
1612149306,sometimes I wish that tttt would just collectively go the fuck outside and interact with actual human beings,comment,glk0y9v,Juuliyuh,0,l9t5cy,,t3_l9t5cy,14,0,0,racist femboy,,,,
1612149406,"Yeah, it’s just really disheartening to see this level of schizophrenic posting get such traction, like, talk to someone, stop obsessing about e-celebs",comment,glk15j0,MyDiaryDesu,0,l9t5cy,,t1_glk0y9v,7,0,0,,,,,
1612149653,"HOLY FUCK

GO OUTSIDE",comment,glk1nqx,Juuliyuh,0,l9t5cy,,t1_glk15j0,10,0,0,racist femboy,,,,
1612154345,"tbh, when you compile it all together like this... it's so incredibly obvious that this is a targeted attack entirely because she's now publicly trans, and trans women are, of course, rapists. 

It makes zero sense, unless you really want it to be true. 

So much reaching. It might be true that they don't like each other. Zero evidence of assault. What a mediocre meme.",comment,glkah5d,yosh_yosh_yosh_yosh,0,l9t5cy,,t3_l9t5cy,25,0,0,,,,,
1612154513,"IKR, though Contra’s radio silence is sus as hell so the schizos are gonna chomp on that bit immediately. I just hope this doesn’t spill into shitty drama on the normie side of shit.",comment,glkaref,MyDiaryDesu,0,l9t5cy,,t1_glkah5d,6,0,0,,,,,
1612155220,"I get that, but if it were me, I'd avoid commenting on the brand new insane /tttt/ conspiracy theory about me too. 

Like... she might not be glued to the board. We know she's been there, we know she's spent some time there. But she's got a brain and maybe that's enough to get her away. At this point she might not even be aware how much it's taking over the board.",comment,glkby0t,yosh_yosh_yosh_yosh,0,l9t5cy,,t1_glkaref,9,0,0,,,,,
1612155546,"Agreed, it’s just weird how she didn’t even make comment about Abi’s coming out, of course the /tttt/ schizophrenics are gonna jump on that, though from a sane place this is really nothing and I hope it stays that way.",comment,glkch6h,MyDiaryDesu,0,l9t5cy,,t1_glkby0t,5,0,0,,,,,
1612157944,"I thought that too, but it occurred to me that maybe if I were her, and we weren't close friends but we were colleagues, she might not... want to. For literally any conceivable reason.

It's expected of her, but these are just people. They're not state officials, or corporate media accounts. They're not required to comment on anything. Maybe she's like... going through stuff. Maybe they don't like each other. Maybe she doesn't feel like she can add anything. Maybe something about commenting on it feels strange.",comment,glkg7wy,yosh_yosh_yosh_yosh,0,l9t5cy,,t1_glkch6h,4,0,0,,,,,
1612158142,"Of course, hope that’s the case, schizos are gonna schizo anyway lel",comment,glkgio3,MyDiaryDesu,0,l9t5cy,,t1_glkg7wy,3,0,0,,,,,
1612158203,yeah lol,comment,glkglwx,yosh_yosh_yosh_yosh,0,l9t5cy,,t1_glkgio3,2,0,0,,,,,
1612158972,"What's a probability:

\-Abby and Natalie are not friends anymore; and its the latter who wants to keep it that way

What's a *possibility:*

\-Abby assaulted Natalie or somehow made her uncomfortable, creating a rift between the two that persists to this day

What's a delusional fever dream cooked up by a brain deprived of sunlight and human touch:

\-Abby transitioning to checkmate Natalie into not speaking out",comment,glkhqoe,Kalvin-TL,0,l9t5cy,,t3_l9t5cy,15,0,0,,,,,
1612163875,Or they just don’t follow each other? I don’t follow most of my friends on social media. It doesn’t mean anything,comment,glkogh5,KiratheCommie,0,l9t5cy,,t1_glkhqoe,3,0,0,,,,,
1612168628,[deleted],comment,glkua6w,[deleted],1,l9t5cy,,t1_glk0y9v,4,0,0,,,,,
1612173615,"At least since the anti-semitism video, possibly earlier",comment,glkzyc9,xenoamr,0,l8tzol,,t1_glfjw55,2,0,0,,,,,
1612179211,Oh shit I thought you had gotten banned from Reddit entirely,comment,gll6g6l,FiveFiveOneTwo,0,l8ac8h,,t1_glcdwca,3,0,0,,,,,
1612190468,Yeah like you really expect all those antisocial boymoders and reppers to go outside?,comment,gllpi5e,[deleted],0,l9t5cy,,t1_glk1nqx,2,0,0,,,,,
1612202434,[deleted],comment,glml38t,[deleted],1,la91kr,,t3_la91kr,12,0,0,,,,,
1612205880,I hate you for posting this.,comment,glmu6lp,FiveFiveOneTwo,0,la91kr,,t3_la91kr,7,0,0,,,,,
1612207951,[deleted],comment,glmzksr,[deleted],1,la91kr,,t3_la91kr,1,0,0,,,,,
1612211688,touch starved,comment,gln951j,lockedpain,0,la91kr,,t1_glmzksr,1,0,0,,,,,
1612218836,[deleted],comment,glnr4hp,[deleted],1,lag7ue,,t3_lag7ue,13,0,0,,,,,
1612224232,[deleted],comment,glo3gd0,[deleted],1,lag7ue,,t3_lag7ue,22,0,0,,,,,
1612225990,"It’s still a little suspect that she doesn’t follow him and has been radio silent for a while when they used to be all over each other. It’s clear that they’re not as close as they used to be 

Not that it means sexual assault or any foul play",comment,glo76j5,Kalvin-TL,0,l9t5cy,,t1_glkogh5,3,0,0,,,,,
1612228894,"&gt;AGP

&gt;be female


ngmi",comment,glodbdl,transthrowaway17701,0,lag7ue,,t3_lag7ue,11,0,0,,,,,
1612229226,....why is this a meme? Why do people evangelically spread it far and wide? What’s the end game? It’s not even funny,comment,gloe0lu,Kalvin-TL,0,l5d756,,t3_l5d756,3,0,0,,,,,
1612230561,It probably means Contra’s gone through something super traumatic like mental health concerns or opium addiction,comment,gloguej,KiratheCommie,0,l9t5cy,,t1_glo76j5,1,0,0,,,,,
1612233390,"&gt; PT is blatantly obsessed with Contra  
  
awful rich coming from /tttt/. haha projector go brrrrrrrrrr",comment,glomphj,DigitalEskarina,0,l9t5cy,,t3_l9t5cy,3,0,0,,,,,
1612234154,so what would the equivalent for mtfs be?,comment,glooaao,theripoffartist,0,lag7ue,,t3_lag7ue,5,0,0,AGP BDD ABCDEFG,,,,
1612244884,this is the biggest brain play I've ever fucking seen,comment,glp7klw,xlFLASHl,0,lag7ue,,t3_lag7ue,8,0,0,,,,,
1612246616,Is that you Dr. Powers?,comment,glpa1ev,SilentFungus,0,lag7ue,,t3_lag7ue,4,0,0,,,,,
1612276873,"Those ""redpilled anti-fap matrix spartan god"" videos",comment,glqfzl5,[deleted],0,lag7ue,,t1_glooaao,14,0,0,,,,,
1612284607,I instantly assume people like this are chasers when they get too supportive,comment,glr1p9q,NazBolFemboy,0,lb03xt,,t3_lb03xt,8,0,0,,,,,
1612300757,McElroy slander will not be tolerated😤,comment,gls70d0,Pm_me_trans_goals,0,lb03xt,,t3_lb03xt,5,0,0,,,,,
1612303004,"Always had this sort of suspicion/unease with PT and how there were so many, super specific trans jokes, trans topics, and all the donating to trans charities, etc.
It was never a bad thing, and I guess it makes more sense now, but it always just kinda ""irked"" me in some way, idk",comment,glscx9g,GoatBoi_,0,lb03xt,,t3_lb03xt,3,0,0,,,,,
1612309831,my guy on the left looks like he's going to be taken out of context to do the soy-face,comment,glssb3s,im--stuff,0,lb03xt,,t3_lb03xt,3,0,0,,,,,
1612310446,"it is tied, I don't know what to do",comment,glstlva,Fentanya,0,l80g0w,,t3_l80g0w,1,0,0,Queen of this subreddit,,,,
1612313716,is it wrong that I masturbated to this? 👉👈,comment,glt0e02,wednesday--,0,lba7w8,,t3_lba7w8,13,0,0,a happy boymoder,,,,
1612314615,Feeling good about your transition? Based,comment,glt292b,Princess_Bugaboo,0,lba7w8,,t3_lba7w8,9,0,0,,,,,
1612316387,"Nope, it's wholesome 100",comment,glt5wtr,Fentanya,0,lba7w8,,t1_glt0e02,13,0,0,Queen of this subreddit,,,,
1612319273,Based and agp pilled,comment,gltbte1,Jimmy_McGill_8-13-01,0,lba7w8,,t1_glt0e02,6,0,0,,,,,
1612352020,This shouldn't turn me on but it does 👀,comment,glumqkc,reallyaveragejo,0,lbaxjx,,t3_lbaxjx,7,0,0,uwu so heckin valid,,,,
1612371738,This is all I want in my life :(,comment,glvpw7p,Elagabala,0,lbqoag,,t3_lbqoag,6,0,0,,,,,
1612373726,"No I did it too

*The brain is the most sensitive erogenous zone*",comment,glvuv8p,[deleted],0,lba7w8,,t1_glt0e02,4,0,0,,,,,
1612373804,"Well, there’s plenty of others like you. Hit up the next bottom4bottom transbian that comments something like that",comment,glvv284,Fentanya,0,lbqoag,,t1_glvpw7p,4,0,0,Queen of this subreddit,,,,
1612375051,HSTS moment,comment,glvy8st,opioidaddictgf,0,lbaxjx,,t3_lbaxjx,3,0,0,dysphoric she/her femboy,,,,
1612381447,What drama,comment,glwecxe,Pm_me_trans_goals,0,lbr3wd,,t3_lbr3wd,7,0,0,,,,,
1612382087,This hit too hard,comment,glwfwpi,mosquitoiv,0,lbutwe,,t3_lbutwe,15,0,0,edit this,,,,
1612382640,This is why you do something in your teens,comment,glwh8yb,[deleted],0,lbutwe,,t3_lbutwe,9,0,0,,,,,
1612384776,Hey this is me but I’m cis agp,comment,glwmgqr,agpthrowaway555,0,lbutwe,,t3_lbutwe,10,0,0,,,,,
1612394672,Hi 😎,comment,glx9fpi,[deleted],0,lbqoag,,t1_glvpw7p,1,0,0,,,,,
1612397518,I still have no clue,comment,glxfbzk,KrillBosby,0,lbr3wd,,t1_glwecxe,3,0,0,,,,,
1612402396,"wow congratulations on having a happy adolescence where you weren't getting beaten up at school and told by your dad what a worthless, morally inferior, lazy failure you were until you just mentally checked out of existence.",comment,glxp872,ntr4ctr,0,lbutwe,,t1_glwh8yb,22,0,0,Level 26 Lawful TERF Cleric,,,,
1612403027,"I'm an HRT repressor. The difference between me and a boymoder is that a boymoder has hope. I recognize that I'm a disgusting male hon and if I stopped repressing I wouldn't be a ""woman"", I'd be a disgusting man in a dress.",comment,glxqi6o,ntr4ctr,0,lbrrru,,t3_lbrrru,7,0,0,Level 26 Lawful TERF Cleric,,,,
1612403107,"Any actual homosexual woman would be horrified by this disgusting male gaze creep shit. This is not how actual homosexual women behave, this is straight male fantasy.",comment,glxqnxj,ntr4ctr,0,lbqoag,,t3_lbqoag,2,0,0,Level 26 Lawful TERF Cleric,,,,
1612405310,"well, they’re both bottoms, and according to the rules of /tttt/, bottoms are women",comment,glxv5bo,Fentanya,0,lbqoag,,t1_glxqnxj,5,0,0,Queen of this subreddit,,,,
1612411241,I need a boyfriend AAAAA 😭😭😭,comment,gly6vtd,reallyaveragejo,0,l5zlf8,,t3_l5zlf8,5,0,0,uwu so heckin valid,,,,
1612415696,"Since the poll was a tie, I’ve decided to allow memes like this, as well as text posts and anything else related to /tttt/ culture, but 4chan screenshots should still be the majority of the content in this sub",comment,glyeq03,Fentanya,0,lbutwe,,t3_lbutwe,13,0,0,Queen of this subreddit,,,,
1612415735,"cis, until you inevitably can’t take it anymore",comment,glyesdc,Fentanya,0,lbutwe,,t1_glwmgqr,13,0,0,Queen of this subreddit,,,,
1612444503,"Honestly, what Ollie did was a huge waste. He was hot af before transition, and he threw it all away to become a hon. Handsome AGPs should just suck it up, marry a nice HSTS, and dedicate themselves to giving their partner all the happiness they can never have themselves. It's the only value their lives can ever have.",comment,glzfep3,ntr4ctr,0,lbo1un,,t3_lbo1un,2,0,0,Level 26 Lawful TERF Cleric,,,,
1612455638,too fucking real jesus,comment,gm03ftb,theripoffartist,0,lbutwe,,t3_lbutwe,6,0,0,AGP BDD ABCDEFG,,,,
1612455864,god i want a fucking bf,comment,gm04197,theripoffartist,0,lbqoag,,t3_lbqoag,2,0,0,AGP BDD ABCDEFG,,,,
1612471314,[deleted],comment,gm17cvr,[deleted],1,lbutwe,,t1_glyeq03,3,0,0,,,,,
1612471466,[deleted],comment,gm17qq7,[deleted],1,lcdx1k,,t3_lcdx1k,5,0,0,,,,,
1612471472,"no, you don’t have to",comment,gm17r9p,Fentanya,0,lbutwe,,t1_gm17cvr,3,0,0,Queen of this subreddit,,,,
1612482296,[removed],comment,gm1x44k,[deleted],1,lbutwe,,t1_glxp872,8,0,0,,,,,
1612482382,yeah I considered it but my dad thought it was a bad idea.,comment,gm1xapo,ntr4ctr,0,lbutwe,,t1_gm1x44k,6,0,0,Level 26 Lawful TERF Cleric,,,,
1612482432,[removed],comment,gm1xehq,[deleted],1,lbutwe,,t1_gm1xapo,6,0,0,,,,,
1612482749,"If only I had daddy issues, then I could be an HSTS.",comment,gm1y31d,ntr4ctr,0,lbutwe,,t1_gm1xehq,9,0,0,Level 26 Lawful TERF Cleric,,,,
1612496704,"fake: anon is in a relationship

gay: anon is dating a queer person",comment,gm2r97x,Juuliyuh,0,lcvqea,,t3_lcvqea,8,0,0,racist femboy,,,,
1612499435,bifurcated tongue,comment,gm2wboo,Juuliyuh,0,lcvpb0,,t3_lcvpb0,4,0,0,racist femboy,,,,
1612499804,"Very true. Not the post, but the fact that ""fake and gay"" has never been more applicable.",comment,gm2wz6k,Fentanya,0,lcvqea,,t1_gm2r97x,3,0,0,Queen of this subreddit,,,,
1612500830,😐w😐,comment,gm2yqfn,Crit-Monkey,0,lcvqea,,t3_lcvqea,3,0,0,,,,,
1612508063,BLANCHTARDS OUT REEEEEEEEEEEE,comment,gm39g1f,Crit-Monkey,0,ld0s8i,,t3_ld0s8i,18,0,0,,,,,
1612510124,This but unironically,comment,gm3c18b,n0t_me_irl,0,ld0s8i,,t1_gm39g1f,12,0,0,,,,,
1612510228,Who said I was being ironic,comment,gm3c5qu,Crit-Monkey,0,ld0s8i,,t1_gm3c18b,11,0,0,,,,,
1612510589,a generous queen,comment,gm3clnl,Juuliyuh,0,lcvym1,,t3_lcvym1,7,0,0,racist femboy,,,,
1612516531,Okay mum,comment,gm3jcdc,maddys-alt,0,lcvym1,,t3_lcvym1,4,0,0,,,,,
1612536758,"Blanchard just wanted to fuck a tranny and couldnt understand why you would transition if it wasnt to fuck him, change my mind",comment,gm4c5dv,Pm_me_trans_goals,0,ld0s8i,,t3_ld0s8i,14,0,0,,,,,
1612546316,"idk, seems kinda based",comment,gm4z45r,theripoffartist,0,lda3xb,,t3_lda3xb,13,0,0,AGP BDD ABCDEFG,,,,
1612562032,Sad gay sounds,comment,gm5yzsp,SnooSuggestions7073,0,kaxz85,,t3_kaxz85,1,0,0,,,,,
1612566317,This is Cafebeef's origin story.,comment,gm67vwq,ntr4ctr,0,ldjfc9,,t3_ldjfc9,8,0,0,Level 26 Lawful TERF Cleric,,,,
1612571562,[deleted],comment,gm6i6o9,[deleted],1,ldl54o,,t3_ldl54o,29,0,0,,,,,
1612571908,In this day and age all of us are rather lonely,comment,gm6iugu,Juuliyuh,0,lda3xb,,t3_lda3xb,7,0,0,racist femboy,,,,
1612583498,"So LGB, straight men with AGP, and straight men who have AGP but delude themselves into believing they don't.",comment,gm745dn,ntr4ctr,0,ld0s8i,,t3_ld0s8i,2,0,0,Level 26 Lawful TERF Cleric,,,,
1612583533,"If you've ever seen Blanchard on video he's pretty obviously gay from like his voice/mannerisms/stuff, so I doubt he's a GAMP.",comment,gm747hz,ntr4ctr,0,ld0s8i,,t1_gm4c5dv,5,0,0,Level 26 Lawful TERF Cleric,,,,
1612599617,imagine being a self hating tranner and also thinking you’re on some NEW shit for it,comment,gm7ps81,QueenOfTransStyle,0,ldjfc9,,t3_ldjfc9,14,0,0,,,,,
1612624106,[deleted],comment,gm8ima5,[deleted],1,ldl54o,,t3_ldl54o,15,0,0,,,,,
1612624135,Kinda hot,comment,gm8io4l,scorchdearth,0,lda3xb,,t3_lda3xb,6,0,0,,,,,
1612624407,They're so mean,comment,gm8j58n,scorchdearth,0,ldl54o,,t3_ldl54o,12,0,0,,,,,
1612626248,What's rare is non self hating tranners. Those don't exist.,comment,gm8mi51,[deleted],0,ldjfc9,,t1_gm7ps81,8,0,0,,,,,
1612644262,imagine /lgbt/ being mean they would never,comment,gm9rftf,yosh_yosh_yosh_yosh,0,ldl54o,,t1_gm8j58n,10,0,0,,,,,
1612644964,I thought I understood what they were trying to say in first pic... but second to last is absolute mystery,comment,gm9tfsh,miladiashe,0,ks08hr,,t3_ks08hr,1,0,0,,,,,
1612652134,[removed],comment,gmaihbx,[deleted],1,ldl54o,,t1_gm8j58n,5,0,0,,,,,
1612678466,Wholesome 😍,comment,gmcq6op,Crit-Monkey,0,le7q4d,,t3_le7q4d,2,0,0,,,,,
1612678530,"broke: my perfect bf will make me wear diapers and care for me

woke: my perfect bf will kill me",comment,gmcq9ly,wednesday--,0,le7q4d,,t3_le7q4d,7,0,0,a happy boymoder,,,,
1612681444,relatable,comment,gmcvhfz,theydystardust,0,leggcu,,t3_leggcu,9,0,0,,,,,
1612684773,"They are both pretty small, but r/actual_tgcj and r/lgbtqcirclejerk exist",comment,gmd7dns,AmGayDoingCrimes,0,leggcu,,t3_leggcu,5,0,0,,,,,
