timestamp,text,type,id,author,is_deleted,submission_id,submission_title,parent_id,score,controversiality,gilded,author_flair_text,link_flair_text,is_self,url,domain
1589916050,"Yeah, that's why we created this sub. If you post on r/4chan, you'll get a shit ton of hate comments for being pro-trans, but if you post it on most of the trans subreddits, you'll get criticized for posting stuff from 4chan, and if there's any slurs in it, they'll probably delete your post and maybe even ban you.",comment,fr5wyin,Fentanya,0,gmua5c,,t3_gmua5c,6,0,0,,,,,
1589916090,There's a lot of hilarious trans-related content on 4chan that deserves a home on reddit.,comment,fr5x1ji,Fentanya,0,gmua5c,,t3_gmua5c,6,0,0,,,,,
1589916574,Everyone seems to hate /lgbt/ elsewhere but it's like home for me,comment,fr5y1ok,TranstrasserismNow,0,gmua5c,,t1_fr5wyin,4,0,0,,,,,
1589919701,the absolute contrast between the last two comments,comment,fr64cl0,baron_iw,0,gmva76,,t3_gmva76,7,0,0,,,,,
1589919785,"well, I'm glad you've found a place where you feel at home.",comment,fr64ipm,Fentanya,0,gmua5c,,t1_fr5y1ok,2,0,0,,,,,
1589919838,The Duality of Tran,comment,fr64mkf,Fentanya,0,gmva76,,t1_fr64cl0,4,0,0,,,,,
1589921404,The sub would be incomplete without this classic,comment,fr67sd5,its_Anne,0,gmwziy,,t3_gmwziy,10,0,0,,,,,
1590006670,"why do I laugh my ass off every time I see the words ""Take your pills, Alice""?",comment,fra0hk2,Fentanya,0,gnj8x3,,t3_gnj8x3,3,0,0,,,,,
1590053827,NOOO I audibly laughed,comment,frbso0r,TranstrasserismNow,0,gmwziy,,t3_gmwziy,4,0,0,,,,,
1590113629,"incels: ""The pinkpill is when you realize that the best way for smaller and weaker men to get laid is to become women.""

femcels: ""The pinkpill is when you open your eyes the true nature of men. It's basically the radfem version of the redpill.""

OP: ""Yeah, I'm just gonna take both pills.""",comment,freoyc2,Fentanya,0,goah6h,,t3_goah6h,12,0,0,,,,,
1590765463,"Whole thread is really insightful and in a way relatable, check it out before it's gone",comment,fs7h8cq,TranstrasserismNow,0,gsu2oj,,t3_gsu2oj,3,0,0,,,,,
1590774166,"\&gt;wholesome or normal rape?  


Jesus fucking Christ, this is your brain on too much Yaoi",comment,fs7zt5l,Fentanya,0,gsu2oj,,t3_gsu2oj,11,0,0,,,,,
1590774411,"At least they had the decency to elaborate on it further down, I feel bad for them because it's clear they're influenced by trauma",comment,fs80cdb,TranstrasserismNow,0,gsu2oj,,t1_fs7zt5l,5,0,0,,,,,
1590926242,Is this the trans agenda?,comment,fseyfak,totalLusa,0,gtwqly,,t3_gtwqly,5,0,0,,,,,
1590926294,That's classified information,comment,fseyhdx,TranstrasserismNow,0,gtwqly,,t1_fseyfak,1,0,0,,,,,
1590928163,Right in the feels :(,comment,fsf0ml2,TranstrasserismNow,0,gtxe4s,,t3_gtxe4s,2,0,0,,,,,
1590934868,"&gt;cishons

LMAO never even heard that one before",comment,fsf9v83,Fentanya,0,gsv800,,t3_gsv800,5,0,0,,,,,
1590954767,HaHa...I think that fits the British bombshell feminists quite nicely! Like Rapid Onset TERFdom over there....,comment,fsgb82u,Autumnacious,0,gsv800,,t1_fsf9v83,2,0,0,,,,,
1590982921,At least they’re honest?,comment,fshptut,cheifbeefkeef,0,gs8qvy,,t3_gs8qvy,4,0,0,,,,,
1591034162,Please be a larp please be a larp,comment,fsjqbl9,TranstrasserismNow,0,gup9mb,,t3_gup9mb,8,0,0,,,,,
1591042705,"Fuck, I could never turn down an offer for free surgeries to make me prettier",comment,fsk81cw,Fentanya,0,gup9mb,,t3_gup9mb,6,0,0,,,,,
1591057628,"If this was any other sub, I'd have to put a trigger warning for the transphobia, suicide, and the N word. But since this a 4chan-related sub, there's no reason to, it's par for the course",comment,fsl0vrs,Fentanya,0,guwozp,,t3_guwozp,1,0,0,,,,,
1591112192,my ex bf is a mixed-race leftist but he has a lot of Nazi books on his bookshelf,comment,fsn7k6n,Fentanya,0,gv99ql,,t3_gv99ql,2,0,0,,,,,
1591114274,It be like that,comment,fsnbuvs,TranstrasserismNow,0,gv99ql,,t3_gv99ql,1,0,0,,,,,
1591114930,"You can fuck the boy out of an MTF, but you can't fuck the boy out of an FTM",comment,fsnd7u2,Fentanya,0,gu5glh,,t3_gu5glh,5,0,0,,,,,
1591115124,"Boyremoving a boymoder is halal, manremoving an ftm is haram",comment,fsndmcv,TranstrasserismNow,0,gu5glh,,t1_fsnd7u2,4,0,0,,,,,
1591196893,"when I was in boymode, my hair was always messy as fuck. I also just wore blank T shirts and sweatpants every day when I wasn't too lazy to change and just wear my girls' pyjamas to class. I just figured, if I was not presenting femme, I wasn't gonna like the way I looked anyways, so why bother putting in any effort?",comment,fsr52zb,Fentanya,0,gvrlv8,,t3_gvrlv8,7,0,0,,,,,
1591200164,I wish boymoder chasers were real :(,comment,fsrc0yd,Sebu_irl,0,gvrlv8,,t3_gvrlv8,7,0,0,,,,,
1591201563,"Tfw no boyremoval bf :(

I'm sure he's out there, somewhere, if I just boymode hard enough he'll find me",comment,fsreyve,TranstrasserismNow,0,gvrlv8,,t1_fsrc0yd,4,0,0,,,,,
1591205612,It's over for TERFcels,comment,fsrnn8r,TranstrasserismNow,0,gvvc00,,t3_gvvc00,4,0,0,,,,,
1591626167,Anarchist trans people and their consequences have been a disaster for the transgender race,comment,ftddxhc,TranstrasserismNow,0,gyzy1j,,t3_gyzy1j,8,0,0,,,,,
1591629936,We must secure the existence of non-anarchist trans people and a future for the transgender race,comment,ftdkztx,Sebu_irl,0,gyzy1j,,t1_ftddxhc,6,0,0,,,,,
1591630809,Based on the state,comment,ftdmow9,TranstrasserismNow,0,gyzy1j,,t1_ftdkztx,3,0,0,,,,,
1592854535,"Okay but in all seriousness, FUCK HER! She wants to perpetuate the cycle of miserable trans women who hate all trans women including themselves instead of allowing them transition earlier and actually pass.",comment,fvo261l,Fentanya,0,hdz3c1,,t3_hdz3c1,9,0,0,,,,,
1592859445,"This is why hons shouldn't have voting rights

Every damn time someone tries to restrict the rights of underage trans people it's some bitter hon/cishon who's mad that they're not attractive

EVERY. DAMN. TIME.",comment,fvoc111,TranstrasserismNow,0,hdz3c1,,t3_hdz3c1,5,0,0,,,,,
1592866792,"Per the poster: ffs, FFS is magic for us oldster transsexuals. I had to do what it took and get myself into debt to pass in the world. Now I feel great. Go to the right doc and you’ll at least assimilate into the world instead of standing out. I needed to see a female face in the mirror for my dysphoria. There’s that option. Quit bitching.",comment,fvoq241,Autumn1972,0,hdz3c1,,t1_fvo261l,7,0,0,,,,,
1592868604,"congrats you summarized like 20% of /lgbt/ users, stay in hon threads untrender",comment,fvota4g,baron_iw,0,hdz3c1,,t3_hdz3c1,3,0,0,,,,,
1592886442,"Always a pleasure to see you around reddit, Autumn",comment,fvpmv4e,Fentanya,0,hdz3c1,,t1_fvoq241,2,0,0,,,,,
1592888456,"Thanks, babe!",comment,fvppo0u,Autumnacious,0,hdz3c1,,t1_fvpmv4e,3,0,0,,,,,
1593060784,You never forget your first malefail,comment,fvxdmti,Fentanya,0,hfahxu,,t3_hfahxu,4,0,0,,,,,
1593100075,"Sigh

Diaperhon extinction button",comment,fvyq73o,TranstrasserismNow,0,hfga95,,t3_hfga95,8,0,0,,,,,
1593329781,Lmao hey,comment,fw8w5ui,BackpackLily,0,hdjp6x,,t3_hdjp6x,4,0,0,,,,,
1593358266,"OMG, it's you! How you doing, queen?",comment,fw9u7tk,Fentanya,0,hdjp6x,,t1_fw8w5ui,2,0,0,,,,,
1593361278,I made the screenshot lmao,comment,fw9zpeq,ED7Gril,0,gvabsf,,t3_gvabsf,2,0,0,,,,,
1593371703,"Quite good, I'm surprised I found this, I googled my name cause I was curious and ended up actually finding somethin'!",comment,fwajndv,BackpackLily,0,hdjp6x,,t1_fw9u7tk,3,0,0,,,,,
1593429270,Some are quite cute &gt;.&lt;,comment,fwcv2m2,ED7Gril,0,hfga95,,t1_fvyq73o,3,0,0,,,,,
1593434250,Only lopey but she still needs to be forced into therapy,comment,fwd15la,TranstrasserismNow,0,hfga95,,t1_fwcv2m2,2,0,0,,,,,
1593434528,Lopey is based af,comment,fwd1j8b,ED7Gril,0,hfga95,,t1_fwd15la,2,0,0,,,,,
1593439682,Based on autopedophilia that is,comment,fwd9izw,TranstrasserismNow,0,hfga95,,t1_fwd1j8b,2,0,0,,,,,
1593440745,Wut,comment,fwdbczw,ED7Gril,0,hfga95,,t1_fwd9izw,2,0,0,,,,,
1593440884,Deep down you know I'm right 😤,comment,fwdbm33,TranstrasserismNow,0,hfga95,,t1_fwdbczw,2,0,0,,,,,
1593441426,Legit don't know what that is,comment,fwdck5i,ED7Gril,0,hfga95,,t1_fwdbm33,1,0,0,,,,,
1593441512,Like AGP is attraction to yourself as a woman APP is attraction to yourself as a child,comment,fwdcpq9,TranstrasserismNow,0,hfga95,,t1_fwdck5i,1,0,0,,,,,
1593441630,Oh. That's not what ageplay is at all tho,comment,fwdcxll,ED7Gril,0,hfga95,,t1_fwdcpq9,1,0,0,,,,,
1593441719,Of course you'd say that,comment,fwdd3h1,TranstrasserismNow,0,hfga95,,t1_fwdcxll,1,0,0,,,,,
1593442553,It's really not tho,comment,fwdem9l,ED7Gril,0,hfga95,,t1_fwdd3h1,1,0,0,,,,,
1593442631,That's kinda by definition what it is,comment,fwderb3,TranstrasserismNow,0,hfga95,,t1_fwdem9l,1,0,0,,,,,
1593443492,It's a means to regress mentally to a time where you felt safer.,comment,fwdgcxa,ED7Gril,0,hfga95,,t1_fwderb3,1,0,0,,,,,
1593443579,Then why is it so sexualized?,comment,fwdgiv6,TranstrasserismNow,0,hfga95,,t1_fwdgcxa,1,0,0,,,,,
1593443924,Idk I'm not one of those that sexualic it so I can't speak to it,comment,fwdh6xu,ED7Gril,0,hfga95,,t1_fwdgiv6,1,0,0,,,,,
1593444162,"Fair enough, but as a whole it's very sexual",comment,fwdhn2n,TranstrasserismNow,0,hfga95,,t1_fwdh6xu,1,0,0,,,,,
1593506376,didn’t even know you could get banned on 4chan,comment,fwggy9o,blondeboyzzz,0,hij1ws,,t3_hij1ws,5,0,0,,,,,
1593506503,Just don't bring leddit drama over to 4chan and you pretty much don't even have to read the rules because they're so lax,comment,fwgh2ut,TranstrasserismNow,0,hij1ws,,t1_fwggy9o,5,0,0,,,,,
1593694071,That’s actually kinda sad.,comment,fwouwvb,labambamabam,0,hjw60t,,t3_hjw60t,3,0,0,,,,,
1593695272,[Round two baby](https://imgur.com/a/8g8NDd3),comment,fwox5he,TranstrasserismNow,0,hjw60t,,t1_fwouwvb,6,0,0,,,,,
1593698000,[deleted],comment,fwp2lky,[deleted],1,hjw60t,,t1_fwox5he,1,0,0,,,,,
1593730052,[deleted],comment,fwqy87d,[deleted],1,hjw60t,,t1_fwox5he,2,0,0,,,,,
1594571398,"Okay but this was actually very cathartic to read lmao. Like, same.",comment,fxuaqcx,its_Anne,0,hogmhu,,t3_hogmhu,3,0,0,,,,,
1594571476,It do be like that,comment,fxuavko,TranstrasserismNow,0,hogmhu,,t1_fxuaqcx,2,0,0,,,,,
1594792798,"still cis tho 

&amp;#x200B;

(I can't share this to r/egg_irl because I'm banned)",comment,fy49qxs,Fentanya,0,hraqt9,,t3_hraqt9,1,0,0,,,,,
1595308814,it never ends,comment,fyqkvsc,Fentanya,0,hujre6,,t3_hujre6,2,0,0,,,,,
1595353329, I want to get off Ms. Mones Wild Ride!,comment,fysba45,TranstrasserismNow,0,hujre6,,t1_fyqkvsc,2,0,0,,,,,
1595354006,lol I don’t! This is the best thing that ever happened to me,comment,fyscnba,Fentanya,0,hujre6,,t1_fysba45,2,0,0,,,,,
1595355428,Based and pinkpilled,comment,fysflpi,TranstrasserismNow,0,hujre6,,t1_fyscnba,2,0,0,,,,,
1595431824,Cissies btfo,comment,fyvpmrp,TranstrasserismNow,0,hvvas3,,t3_hvvas3,3,0,0,,,,,
1595515348,[deleted],comment,fyzfjq4,[deleted],1,hvvas3,,t3_hvvas3,1,0,0,,,,,
1595809743,What is this tumblr shit,comment,fzctlpl,OldSchooler22,0,hy98k5,,t3_hy98k5,2,0,0,,,,,
1595888117,Because it’s my preferred method of self harm uwu,comment,fzg9k73,Vorinebt,0,hz07df,,t3_hz07df,4,0,0,,,,,
1595945064,"Now that all the TERF subreddits are gone, where else can you go?",comment,fzihjtd,Fentanya,0,hz07df,,t1_fzg9k73,3,0,0,,,,,
1595945084,two kinds of 4chan tranners,comment,fzihl1r,Fentanya,0,hz07df,,t3_hz07df,2,0,0,,,,,
1595982503,Cuz she's actually 16 and a decent person,comment,fzkkh5v,ED7Gril,0,hvvas3,,t1_fyzfjq4,1,0,0,,,,,
1595983825,Inspiring,comment,fzkmuk2,totalLusa,0,hzfwvk,,t3_hzfwvk,2,0,0,,,,,
1595996148,"i thought this would end in a “gotcha, i’m actually still boymoding and there’s no way out” kind of ending",comment,fzl7xsk,TrueFun,0,hzfwvk,,t3_hzfwvk,2,0,0,,,,,
1596076056,Okay legitimately though this rules. If agp is part of your sexuality there’s no reason to be ashamed of it.,comment,fzot5ap,its_Anne,0,i02497,,t3_i02497,4,0,0,,,,,
1596084143,Overcoming my shame of being AGP and transitioning anyways was the best decision I’ve ever made,comment,fzp5v3o,Fentanya,0,i02497,,t1_fzot5ap,4,0,0,,,,,
1596093614,"Upon reflection now, i was on autopilot during my transition, but overcoming the shame of AGP was a harder battle than Everest. I now accept my sexuality, and couldn't be more pleased with my damn self.",comment,fzph686,Autumnacious,0,i02497,,t1_fzp5v3o,4,0,0,,,,,
1596100159,"I used to subscribe to Julia Serano's view of agp, and I basically still do, except I think it's better to call it agp than female embodiment fantasies or whatever. Agp is more accurately descriptive, and we shouldn't be running away from terms and concepts because transphobes have tried to weaponize them. fuck the transphobes, fuck blanchard, reclaim agp. imo.",comment,fzpnpw2,its_Anne,0,i02497,,t1_fzp5v3o,3,0,0,,,,,
1596120649,"&gt;fuck the transphobes, fuck blanchard, reclaim agp

my thoughts exactly",comment,fzqfeb5,Fentanya,0,i02497,,t1_fzpnpw2,4,0,0,,,,,
1596140323,"4chan and tumblr have always been soulmates

https://pbs.twimg.com/media/CwcxWrpXUAAtJXd.jpg

https://i.kym-cdn.com/photos/images/facebook/000/788/443/dc0.png",comment,fzrxvup,lajriaty,0,hy98k5,,t1_fzctlpl,3,0,0,,,,,
1596140796,"the dumbest thing is when some shithead anon tells you you're not using ""AGP"" correctly because blanchard defined it some specific way, when the whole point is that blanchard doesn't know what he's talking about but still coined a useful term.",comment,fzs0a52,lajriaty,0,i02497,,t1_fzpnpw2,3,0,0,,,,,
1596255500,"even when I was a boymoder, I would still prioritize doing all sexual activity in girlmode",comment,fzyctsp,Fentanya,0,i1inu2,,t3_i1inu2,3,0,0,,,,,
1596625804,[deleted],comment,g0fjxc7,[deleted],1,i3vu4c,,t3_i3vu4c,1,0,0,,,,,
1596731720,"instant death penalty for saying the word ""clitty"" tbhon",comment,g0ktw9e,TranstrasserismNow,0,i4uute,,t3_i4uute,11,0,0,☣️ROGD BIOWEAPON CARRIER☣️👸🏼,,,,
1596736617,which execution method are you considering dealing out?,comment,g0l4tfb,Fentanya,0,i4uute,,t1_g0ktw9e,5,0,0,group founder,,,,
1596736773,"death by estrogen overdose

liver failure",comment,g0l574j,TranstrasserismNow,0,i4uute,,t1_g0l4tfb,6,0,0,☣️ROGD BIOWEAPON CARRIER☣️👸🏼,,,,
1596736901,"Based! My brother often tells his friends “My brother is dead, he overdosed on estrogen”",comment,g0l5hnf,Fentanya,0,i4uute,,t1_g0l574j,6,0,0,group founder,,,,
1596737356,based bro,comment,g0l6k6l,TranstrasserismNow,0,i4uute,,t1_g0l5hnf,3,0,0,☣️ROGD BIOWEAPON CARRIER☣️👸🏼,,,,
1596768726,What exactly is AGP? I thought it meant lesbian transgenders with autosexual tendencies?,comment,g0mvzje,Ledoingnothing,0,i4z656,,t3_i4z656,2,0,0,,,,,
1596772607,basically an autosexual fixation with your feminized self,comment,g0n2d40,Fentanya,0,i4z656,,t1_g0mvzje,3,0,0,group founder,,,,
1596774406,"Huh, how does that work exactly?",comment,g0n54ru,Ledoingnothing,0,i4z656,,t1_g0n2d40,2,0,0,,,,,
1596782615,I love this post. :) Too bad more TRAs don't just embrace it and get on with life...It really is quite wonderful when you throw away the shame.,comment,g0nfvie,Autumnacious,0,i4z656,,t3_i4z656,1,0,0,,,,,
1597035267,I laughed way harder at this than I probably should've,comment,g0yr7gp,Fentanya,0,i627j6,,t3_i627j6,3,0,0,group founder,,,,
1597482920,What the fuck did I just read,comment,g1k1fet,Ledoingnothing,0,ia369z,,t3_ia369z,14,0,0,,,,,
1597509411,Blanchardians are a parody of themselves,comment,g1m38fl,n0t_me_irl,0,ia369z,,t3_ia369z,14,0,0,,,,,
1597944806,Can confirm I have FTM AGP,comment,g28fmk5,Ledoingnothing,0,ictvjt,,t3_ictvjt,6,0,0,,,,,
1597945876,base,comment,g28hxi5,TranstrasserismNow,0,ictvjt,,t1_g28fmk5,5,0,0,☣️ROGD BIOWEAPON CARRIER☣️👸🏼,,,,
1597952295,[deleted],comment,g28wl6q,[deleted],1,ia369z,,t3_ia369z,3,0,0,,,,,
1597960249,me neither,comment,g29f9fw,Fentanya,0,ia369z,,t1_g28wl6q,1,0,0,group founder,,,,
1597999240,This is actually not uncommon. Sexuality is weird.,comment,g2b3ayl,its_Anne,0,ictvjt,,t3_ictvjt,3,0,0,,,,,
1598091282,ELI5 what the bloody hell agp is,comment,g2g1wm3,Crit-Monkey,0,ictvjt,,t3_ictvjt,1,0,0,,,,,
1598093547,"Auto Gyne Philia

Love of yourself as a woman

It's supposedly a sub orientation under male heterosexuality that misdirects it inwards, Blanchard argues that all mtfs that like women have this.",comment,g2g708n,TranstrasserismNow,0,ictvjt,,t1_g2g1wm3,4,0,0,☣️ROGD BIOWEAPON CARRIER☣️👸🏼,,,,
1598115644,Thanks I hate it,comment,g2hpdf2,Crit-Monkey,0,ictvjt,,t1_g2g708n,5,0,0,,,,,
1600754662,Need some hot boymoder on boymoder action.,comment,g66v5dv,[deleted],0,i1inu2,,t3_i1inu2,2,0,0,,,,,
1600985383,Don't worry I like force femme too.,comment,g6h3s71,[deleted],0,gmva76,,t3_gmva76,2,0,0,,,,,
1602451097,Just load the clip full so both me and my insurance save money,comment,g8j18el,jidlar,0,j8xfma,,t3_j8xfma,13,0,0,,,,,
1602548953,Based,comment,g8n9ay4,Ledoingnothing,0,j8xfma,,t3_j8xfma,1,0,0,,,,,
1603482765,"People are already subjected to psychiatric examination which is similar to russian roulette except it's worse than dying

[https://vintologi.com/threads/psychiatry-horror-stories.267](https://vintologi.com/threads/psychiatry-horror-stories.267)",comment,g9shu7b,vintologi_se,0,j8xfma,,t3_j8xfma,5,0,0,,,,,
1604803632,You of all people would be on this sub,comment,gbjhast,OverlyThunked,0,inb7qy,,t3_inb7qy,2,0,0,,,,,
1604810055,I helped create it,comment,gbjzwa1,Fentanya,0,inb7qy,,t1_gbjhast,2,0,0,Queen of this subreddit,,,,
1604841610,Unsurprising,comment,gblye4d,OverlyThunked,0,inb7qy,,t1_gbjzwa1,2,0,0,,,,,
1605494465,"&gt;im just a mildly dysphoric femboy who wants hrt

wow that really clobbered me with nostalgia for a time when i still believed the lie that i could cure my dysphoria and not be visibly trans.


bazooper",comment,gcgf4xi,sneakygingertroll,0,i3vu4c,,t3_i3vu4c,5,0,0,,,,,
1605496231,[deleted],comment,gcgigdk,[deleted],1,i02497,,t1_fzp5v3o,2,0,0,,,,,
1605631758,"based

i wish this sub had more contributions, it's so good, and there's so much good content that deserves reposting",comment,gcmicwy,yosh_yosh_yosh_yosh,0,jvvoqd,,t3_jvvoqd,6,0,0,,,,,
1605658971,u/Fentanya,comment,gco33o9,Juuliyuh,0,jvvoqd,,t1_gcmicwy,2,0,0,racist femboy,,,,
1605664411,"\&gt;""you can't transition you'll only manipulate men into having sex and take advantage of them11111""

Yes.",comment,gcoct3a,im--stuff,0,jw624o,,t3_jw624o,9,0,0,,,,,
1605677884,Damn she really is me,comment,gcoydun,Juuliyuh,0,jw624o,,t3_jw624o,3,0,0,racist femboy,,,,
1605683611,[removed],comment,gcp537c,[deleted],1,jw6440,,t3_jw6440,5,0,0,,,,,
1605683670,[removed],comment,gcp55hs,[deleted],1,jw624o,,t3_jw624o,4,0,0,,,,,
1605683697,god if only i were brave enough,comment,gcp56lx,yosh_yosh_yosh_yosh,0,jw624o,,t1_gcoct3a,6,0,0,,,,,
1605683765,[removed],comment,gcp59b4,[deleted],1,jw9h69,,t3_jw9h69,11,0,0,,,,,
1605683832,[removed],comment,gcp5bz5,[deleted],1,jukog5,,t3_jukog5,9,0,0,,,,,
1605745651,"how's the format of this, is it annoying",comment,gcs1a6v,yosh_yosh_yosh_yosh,0,jw9h69,,t1_gcp59b4,2,0,0,,,,,
1605745932,[removed],comment,gcs1so4,[deleted],1,jw9h69,,t1_gcs1a6v,3,0,0,,,,,
1605750994,sick,comment,gcsb1rz,yosh_yosh_yosh_yosh,0,jw9h69,,t1_gcs1so4,1,0,0,,,,,
1605829294,i like it. conversational vibe,comment,gcvy5du,loudle,0,jw9h69,,t1_gcs1a6v,2,0,0,,,,,
1605849845,now this is content,comment,gcwxyg4,yosh_yosh_yosh_yosh,0,jxhlx2,,t3_jxhlx2,2,0,0,,,,,
1605898544,[deleted],comment,gcyv3od,[deleted],1,jxhlx2,,t3_jxhlx2,1,0,0,,,,,
1605942964,so true,comment,gd0yejy,TranstrasserismNow,0,jy4p6u,,t3_jy4p6u,5,0,0,☣️ROGD BIOWEAPON CARRIER☣️👸🏼,,,,
1606384135,[deleted],comment,gdna6fq,[deleted],1,k1c4px,,t3_k1c4px,1,0,0,,,,,
1606384213,"&gt;blanchard using erections to measure arousal in response to agp stimuli

are we sure this whole thing hasn't just been a scam to get the government to fund his sissy hypno fetish?",comment,gdnaadk,sneakygingertroll,0,k1c4px,,t3_k1c4px,8,0,0,,,,,
1606384276,"I'll be honest, I'm pretty sure that's what it is",comment,gdnadgp,yosh_yosh_yosh_yosh,0,k1c4px,,t1_gdnaadk,6,0,0,,,,,
1606386589,i love when you can tell being trans really hasnt changed someone from who they were before. it takes a special kind of self loathing to continue using 4chan after realizing you're trans.,comment,gdndgp1,sneakygingertroll,0,jtg61q,,t3_jtg61q,3,0,0,,,,,
1606526268,is this someone trying to explain what dysphoria feels like,comment,gdtlygk,Juuliyuh,0,k2drlw,,t3_k2drlw,3,0,0,racist femboy,,,,
1606526734,"I think it's a joke about pregnancy dysphoria, it was on /lgbt/ and OP didn't say anything else.",comment,gdtmpw5,yosh_yosh_yosh_yosh,0,k2drlw,,t1_gdtlygk,5,0,0,,,,,
1606565875,"Oh wait I totally had this too except reversed (im mtf) like I would look in the mirror and think ""hes cute, id date him, but I don't wanna be him"".",comment,gdv3lyx,X6062,0,ictvjt,,t3_ictvjt,3,0,0,,,,,
1606630495,"these agp's rly be out here insisting the ONLY reason they transition is/was agp

this story is probably bait but idk i have kind of a hard time believing anyone would transition and stay that way and get srs and have it be ""just a fetish""",comment,gdzi9dh,sneakygingertroll,0,k327dx,,t3_k327dx,13,0,0,,,,,
1606630690,I can’t wait for this to happen to me pogchamp,comment,gdzip2c,Juuliyuh,0,k327dx,,t3_k327dx,6,0,0,racist femboy,,,,
1606631020,based,comment,gdzjel4,sneakygingertroll,0,hvvas3,,t3_hvvas3,3,0,0,,,,,
1606631069,"Honestly, I kinda had some AGP myself, and transitioning was what slowed it down. I’ll never be as horny as I was pre-transition again, but that’s probably for the besy",comment,gdzji86,Fentanya,0,k327dx,,t1_gdzi9dh,9,0,0,Queen of this subreddit,,,,
1606631110,"Fine, I guess you are my little pogchamp. Come here 💕",comment,gdzjldg,Fentanya,0,k327dx,,t1_gdzip2c,6,0,0,Queen of this subreddit,,,,
1606631183,thanks mom 🥺😢,comment,gdzjrjz,Juuliyuh,0,k327dx,,t1_gdzjldg,4,0,0,racist femboy,,,,
1606645773,OMG 😂😂😂,comment,ge0fedt,Fentanya,0,k34zq6,,t3_k34zq6,11,0,0,Queen of this subreddit,,,,
1606672095,Can confirm,comment,ge2531o,Juuliyuh,0,k34zq6,,t1_ge0fedt,7,0,0,racist femboy,,,,
1606672306,"yes, we certainly can",comment,ge25ijh,Fentanya,0,k34zq6,,t1_ge2531o,5,0,0,Queen of this subreddit,,,,
1606678900,Lol my girlfriend and I are on acharty too. We're big geography nerds! 🤓,comment,ge2jn6q,Zina_Zendik,0,k34zq6,,t3_k34zq6,7,0,0,,,,,
1606693684,this is your brain on 5 years of minimal human contact doing nothing but hating yourself and getting serotonin from masturbating to more and more fucked up shit in order to continuously ensure your fried brain gets some sweet neurotransmitters,comment,ge3gcx8,Juuliyuh,0,k33n9h,,t3_k33n9h,12,0,0,racist femboy,,,,
1606702171,yup,comment,ge3vgh7,Fentanya,0,k33n9h,,t1_ge3gcx8,7,0,0,Queen of this subreddit,,,,
1606770676,larp as a turkey,comment,ge6s7xa,theripoffartist,0,k2drlw,,t3_k2drlw,2,0,0,AGP BDD ADHD SAD BPD,,,,
1606779808,\*wife,comment,ge7ciwd,Fentanya,0,k48grv,,t3_k48grv,3,0,0,Queen of this subreddit,,,,
1606822561,"tbh a lot of bad and a lot of good, at least on 4chan i can say what i really feel without judgement, noone will bring it up again next time i post

even though i'm a minor

jannies wont ever catch me😎",comment,ge90scg,TranstrasserismNow,0,jtg61q,,t1_gdndgp1,3,0,0,☣️ROGD BIOWEAPON CARRIER☣️👸🏼,,,,
1606822668,This is beyond science,comment,ge90w5w,TranstrasserismNow,0,ictvjt,,t1_gdv3lyx,1,0,0,☣️ROGD BIOWEAPON CARRIER☣️👸🏼,,,,
1607020090,"\&gt;2 years on hrt

\&gt;am i trans

certified tttt moment",comment,geie74d,TranstrasserismNow,0,k62x42,,t3_k62x42,10,0,0,☣️ROGD BIOWEAPON CARRIER☣️👸🏼,,,,
1607068528,"""now post boobies."" an anon that knows what they want.",comment,gekpk0b,[deleted],0,k62x42,,t3_k62x42,2,0,0,,,,,
1607104892,What the fu-,comment,gem8xom,Cheezefemboyo1,0,k6ptgu,,t3_k6ptgu,2,0,0,,,,,
1607105028,just a normal day on tttt,comment,gem97y5,TranstrasserismNow,0,k6ptgu,,t1_gem8xom,3,0,0,☣️ROGD BIOWEAPON CARRIER☣️👸🏼,,,,
1607105047,tttt?,comment,gem99cw,Cheezefemboyo1,0,k6ptgu,,t1_gem97y5,2,0,0,,,,,
1607105089,"lesbian gay bisexual trans

trans trans trans trans",comment,gem9cmc,TranstrasserismNow,0,k6ptgu,,t1_gem99cw,2,0,0,☣️ROGD BIOWEAPON CARRIER☣️👸🏼,,,,
1607105112,I see.,comment,gem9e7g,Cheezefemboyo1,0,k6ptgu,,t1_gem9cmc,2,0,0,,,,,
1607127887,"this is illegal, i'm reporting this to the federales",comment,genho93,[deleted],0,k6ptgu,,t3_k6ptgu,2,0,0,,,,,
1607270834,I feel bad for laughing.,comment,geucw7g,Cheezefemboyo1,0,jw6440,,t3_jw6440,3,0,0,,,,,
1607448953,this post is a bingo list of every /lgbt/ phrase,comment,gf2mww0,TrueFun,0,k94t09,,t3_k94t09,11,0,0,,,,,
1607452573,do you really expect anything of quality and substance coming from /tttt/ lmao,comment,gf2uuj3,Juuliyuh,0,k94s16,,t3_k94s16,5,0,0,racist femboy,,,,
1607453454,sometimes a good laugh,comment,gf2wt8j,Fentanya,0,k94s16,,t1_gf2uuj3,4,0,0,Queen of this subreddit,,,,
1607454354,good point UwU,comment,gf2ytf0,Juuliyuh,0,k94s16,,t1_gf2wt8j,3,0,0,racist femboy,,,,
1607482152,"&gt;tfw no post-womb-transplant femboy bf

Just date a pre-T ftm like the rest of us, hon",comment,gf4mch5,velocibirb,0,k94t09,,t3_k94t09,5,0,0,,,,,
1607554561,I don't see meta attraction anywhere 😔,comment,gf7w2t8,millionaireDegen,0,k94t09,,t1_gf2mww0,3,0,0,,,,,
1607595981,based (what the fuck ?? lmao),comment,gf9kbg6,[deleted],0,kacnsz,,t3_kacnsz,8,0,0,,,,,
1607596195,"unironically based

only way to get out of gender is to push medical transition to the extreme until it's impossible to put people in sex boxes any more",comment,gf9kiic,TranstrasserismNow,0,kacnsz,,t1_gf9kbg6,13,0,0,☣️ROGD BIOWEAPON CARRIER☣️👸🏼,,,,
1607605076,post vaginoplasty phalloplasty or you're a poser,comment,gf9tv01,yosh_yosh_yosh_yosh,0,kacnsz,,t3_kacnsz,17,0,0,,,,,
1607610750,mate just say you’re enby until you figure it out that’s a lot less headache,comment,gfa4m76,Juuliyuh,0,kacnsz,,t3_kacnsz,10,0,0,racist femboy,,,,
