timestamp,text,type,id,author,is_deleted,submission_id,submission_title,parent_id,score,controversiality,gilded,author_flair_text,link_flair_text,is_self,url,domain
1612725424,"It’s possible to get banned from tgcj?, how’d ya manage that",comment,gmhre9h,masochistic_idiot,0,leggcu,,t3_leggcu,10,0,0,Tran wreck,,,,
1612726514,"Because it's Fentanya, I'm guessing unironic Blanchardianism",comment,gmhtlup,n0t_me_irl,0,leggcu,,t1_gmhre9h,17,0,0,,,,,
1612735433,"by then, the Trans Agenda will be fully set into place, and all kids will be forced to take e",comment,gmijzw8,abbystraaalt,0,jukog5,,t1_gcp5bz5,2,0,0,,,,,
1612736249,[removed],comment,gmilkm6,[deleted],1,lecf6m,,t3_lecf6m,5,0,0,,,,,
1612739645,&gt;can confirm this can happen,comment,gmisbjx,shortfagboy,0,lag7ue,,t3_lag7ue,1,0,0,,,,,
1612749872,yep,comment,gmjcoup,Fentanya,0,leggcu,,t1_gmhtlup,9,0,0,Queen of this subreddit,,,,
1612750931,100% deserved,comment,gmjewwv,n0t_me_irl,0,leggcu,,t1_gmjcoup,14,0,0,,,,,
1612764361,UwU wholesome moment,comment,gmk0gd7,Fentanya,0,lf49h7,,t3_lf49h7,10,0,0,Queen of this subreddit,,,,
1612775805,"Youre fucking trans no shit you want to fuck a guy. 

Most women dont find every guy they meet hot ffs",comment,gmkd5j9,OldSchooler22,0,lf49h7,,t3_lf49h7,13,0,0,,,,,
1612804800,"I unironically think that if born in the current times, yes she would’ve transitioned",comment,gmlmjrs,Juuliyuh,0,lffets,,t3_lffets,8,0,0,racist femboy,,,,
1612810522,Imagine sabotaging your own love for another person because you unironically believe Blanchard's debunked bullshit,comment,gmlzhpd,n0t_me_irl,0,lf49h7,,t3_lf49h7,14,0,0,,,,,
1612813068,"Is there actually any signs, Or is this a shitpost to complicated for me to understand?",comment,gmm56rg,KrillBosby,0,lffets,,t1_gmlmjrs,6,0,0,,,,,
1612814385,bars,comment,gmm84qh,theripoffartist,0,lfjvs4,,t3_lfjvs4,5,0,0,AGP BDD ABCDEFG,,,,
1612817358,"The fact that someone made this. 

Also “Blanchard is a repressor” This but unironicaly",comment,gmmeonm,Pm_me_trans_goals,0,lfjvn9,,t3_lfjvn9,38,0,0,,,,,
1612818149,[deleted],comment,gmmggdz,[deleted],1,lffets,,t1_gmm56rg,8,0,0,,,,,
1612819714,Words cannot express the burning hatred this picture instills in me.,comment,gmmjwxi,Cheezefemboyo1,0,lfjrzx,,t3_lfjrzx,8,0,0,,,,,
1612822293,Damn you put more effort into this meme than I have into my life,comment,gmmpkaq,mosquitoiv,0,lfjvn9,,t3_lfjvn9,13,0,0,edit this,,,,
1612823578,"lol I didn’t make it. The person who posted it on /lgbt/ was anon, so I couldn’t give them credit",comment,gmmsb55,Fentanya,0,lfjvn9,,t1_gmmpkaq,11,0,0,Queen of this subreddit,,,,
1612823741,[deleted],comment,gmmsnca,[deleted],1,leggcu,,t3_leggcu,3,0,0,,,,,
1612825601,[deleted],comment,gmmwgtw,[deleted],1,lfjvn9,,t3_lfjvn9,3,0,0,,,,,
1612832738,this is amazing,comment,gmnadc8,yosh_yosh_yosh_yosh,0,lfjvn9,,t3_lfjvn9,2,0,0,,,,,
1612833769,May possibly be largely my fault.,comment,gmnccor,ntr4ctr,0,leggcu,,t1_gmhre9h,5,0,0,Level 26 Lawful TERF Cleric,,,,
1612837803,Tag urself I’m he/him stealth girlmoder,comment,gmnk4rn,Princess_Bugaboo,0,lfjvn9,,t3_lfjvn9,10,0,0,,,,,
1612839090,bars,comment,gmnmml5,QueenOfTransStyle,0,lfjrzx,,t3_lfjrzx,7,0,0,,,,,
1612840844,Thank fucking God the furthest I go is r/itsafetish,comment,gmnpx8n,Worm6974,0,lfjvn9,,t3_lfjvn9,10,0,0,,,,,
1612843902,downdooted wheres the brapmoders,comment,gmnvgj0,lockedpain,0,lfjvn9,,t3_lfjvn9,6,0,0,,,,,
1612862861,me,comment,gmojqlm,Juuliyuh,0,lfjvs4,,t3_lfjvs4,2,0,0,racist femboy,,,,
1612864353,I got second hand horny reading this.,comment,gmol7zc,Late2thePunch,0,lfyrks,,t3_lfyrks,14,0,0,edit this,,,,
1612866558,Solid idea,comment,gmonfzg,mosquitoiv,0,lfyrks,,t3_lfyrks,3,0,0,edit this,,,,
1612878760,"Picked my favourite one, made it my flair",comment,gmp3d0q,mosquitoiv,0,lfjvn9,,t1_gmmsb55,2,0,0,edit this,,,,
1612885163,"A    G    P

G

P",comment,gmpg9x5,[deleted],0,lfyrks,,t1_gmol7zc,2,0,0,,,,,
1612885295,And?...,comment,gmpgk8u,Late2thePunch,0,lfyrks,,t1_gmpg9x5,4,0,0,edit this,,,,
1612887197,This is PEAK HSTS,comment,gmpkurj,Fentanya,0,lfyrks,,t3_lfyrks,5,0,0,Queen of this subreddit,,,,
1612895288,"reposter

reposter",comment,gmq3ve0,yosh_yosh_yosh_yosh,0,lfyrks,,t3_lfyrks,1,0,0,,,,,
1612895737,/cuteboys/ OG's represent,comment,gmq4xhp,trans-jess,0,lfjvn9,,t3_lfjvn9,7,0,0,,,,,
1612896152,"That's a relatively new meme, so that might be why. I'm still not sure what people are talking about when they say ""brapmoder"". I do a google image search for it and it's all motorbike shit.",comment,gmq5wj2,Fentanya,0,lfjvn9,,t1_gmnvgj0,2,0,0,Queen of this subreddit,,,,
1612896193,"but your flair still just says ""edit this""",comment,gmq600r,Fentanya,0,lfjvn9,,t1_gmp3d0q,6,0,0,Queen of this subreddit,,,,
1612898557,"brap is the written way of what a fart sounds like

brapmoder means a tran with a fetish",comment,gmqbk8v,lockedpain,0,lfjvn9,,t1_gmq5wj2,3,0,0,,,,,
1612898902,"I have heard of the ""brap"" fart fetish meme before, I just didn't know that brapmoder had anything to do with it.",comment,gmqcdn5,Fentanya,0,lfjvn9,,t1_gmqbk8v,2,0,0,Queen of this subreddit,,,,
1612909400,don't ever be ashamed of who you are,comment,gmr0s5c,im--stuff,0,lfyrks,,t3_lfyrks,2,0,0,,,,,
1612911670,epp sorryyy . I found this image on /tttt/ and didn't check reddit before posting,comment,gmr5h1g,wednesday--,0,lfyrks,,t1_gmq3ve0,2,0,0,a happy boymoder,,,,
1612914528,"lol it's okay i don't think anyone actually cares

it's funny that someone took my screenshot from reddit and then reposted it to /tttt/ and then it got reposted back on reddit though",comment,gmrb2q7,yosh_yosh_yosh_yosh,0,lfyrks,,t1_gmr5h1g,4,0,0,,,,,
1613015684,"hey, I may be a ugly boymoder, but at least I engage in appropriate hygienic routine",comment,gmwg1jo,theripoffartist,0,lhbmvv,,t3_lhbmvv,20,0,0,AGP BDD ABCDEFG,,,,
1613018793,"god, this is so wholesome",comment,gmwle4n,Fentanya,0,lhbmvv,,t3_lhbmvv,17,0,0,Queen of this subreddit,,,,
1613024077,Lol surprisingly wholesome,comment,gmwta55,Zina_Zendik,0,lhbmvv,,t3_lhbmvv,10,0,0,,,,,
1613034290,This was cute up until I read what name this was posted by.,comment,gmx52j2,Late2thePunch,0,lhbmvv,,t3_lhbmvv,11,0,0,edit this,,,,
1613067734,God i wish that were me,comment,gmys8a9,OceanoDeRoca,0,lhbmvv,,t3_lhbmvv,2,0,0,,,,,
1613078969,oof. Early HRT tiddies hurt already. oof,comment,gmzirrb,reallyaveragejo,0,lhnk7j,,t3_lhnk7j,7,0,0,uwu so heckin valid,,,,
1613091134,"Bisexual women get a lot of hate on /lgbt/. Even this relatively supportive post is based on stereotypes, most of which are negative.",comment,gn082wx,Fentanya,0,lhzle6,,t3_lhzle6,13,0,0,Queen of this subreddit,,,,
1613091531,Why is it specifically bi women? Yeah /lgbt/ board in general hates bisexuals but what is it about being a bi woman specifically that causes /lgbt/ to hate them more than other bisexuals.,comment,gn08uja,TransBoyTobias,0,lhzle6,,t1_gn082wx,6,0,0,ftm hands wrote this,,,,
1613092900,Because misogyny,comment,gn0bg4j,Fentanya,0,lhzle6,,t1_gn08uja,10,0,0,Queen of this subreddit,,,,
1613093590,"That's what I thought lol, but most /lgbt/ users wouldn't outright admit that that's the reason.",comment,gn0crt2,TransBoyTobias,0,lhzle6,,t1_gn0bg4j,4,0,0,ftm hands wrote this,,,,
1613094272,"my favorite comments were  
""No, you will be reborn as a woman once for every person you raped in your previous lifes. Enjoy spending this millenium as a woman, OP. ""

and

""Some terf will unironically share this shitpost as evidence that troons (TiM) are rapists even though op is ostensibly an ftm""",comment,gn0e2rz,Fentanya,0,li0mhj,,t3_li0mhj,17,0,0,Queen of this subreddit,,,,
1613095003,"The board denies the existence of bi people more than they hate them tbh 

If you’re a bi...

•Cis woman: Fundamentally straight and just experimenting 

•Cis guy: Prison gay/“GAMP”

•Trans woman: Fundamentally lesbian, just meta attracted 

•Trans man: horny Fujo",comment,gn0fgjl,Kalvin-TL,0,lhzle6,,t1_gn082wx,16,0,0,,,,,
1613095253,"Nailed it! That’s literally how they deny the existence of bi people of every gender. Well, except bi enbies. For their take on that, see bi cis women.",comment,gn0fxkt,Fentanya,0,lhzle6,,t1_gn0fgjl,11,0,0,Queen of this subreddit,,,,
1613105390,What is this and why is it on this sub,comment,gn0yfaq,OldSchooler22,0,li0mhj,,t3_li0mhj,6,0,0,,,,,
1613107701,bruh moment,comment,gn124re,yosh_yosh_yosh_yosh,0,li0mhj,,t3_li0mhj,6,0,0,,,,,
1613110237,the timeline where you once accidentally fell asleep listening to bambi sleep,comment,gn15suf,wednesday--,0,li4xfq,,t3_li4xfq,5,0,0,a happy boymoder,,,,
1613113837,"INCEL

TO

TRANNY

PIPELINE",comment,gn1ac88,theripoffartist,0,li4xfq,,t3_li4xfq,14,0,0,AGP BDD ABCDEFG,,,,
1613113870,"I think their reasoning is as follows: 

Women are way more likely to identify as bi, even if they’re straight “for all intents and purposes”. Men are less likely to do so, even if it is an accurate label, because of how much it can tank your prospects with women. Not a huge cost, but it’s still something of a cost. 

So they essentially see bi cis girls as those who suffer the least for being in the LGBTQ umbrella. The light skins of gayness",comment,gn1adml,Kalvin-TL,0,lhzle6,,t1_gn08uja,6,0,0,,,,,
1613114454,whats the difference 😏,comment,gn1b2dr,lockedpain,0,li4xfq,,t1_gn1ac88,6,0,0,,,,,
1613117466,B),comment,gn1eho4,theripoffartist,0,li4xfq,,t1_gn1b2dr,2,0,0,AGP BDD ABCDEFG,,,,
1613137527,"&gt;like a normal person

more like a closeted tran",comment,gn22hru,scorchdearth,0,li4xfq,,t3_li4xfq,6,0,0,,,,,
1613152083,pokedex #591,comment,gn2xlxy,theripoffartist,0,lif8c6,,t3_lif8c6,5,0,0,AGP BDD ABCDEFG,,,,
1613152551,Tiddies,comment,gn2yqis,[deleted],0,li4xfq,,t1_gn1b2dr,3,0,0,,,,,
1613152576,Isn't this like everyone when they're trying to repress.,comment,gn2ysqu,[deleted],0,li4xfq,,t3_li4xfq,7,0,0,,,,,
1613152921,when the faggot is sus,comment,gn2zmf8,lockedpain,0,lif8c6,,t3_lif8c6,14,0,0,,,,,
1613153105,I'm pretty sure I was born AMAB as punishment for being a misandrist TERF in a past life.,comment,gn301t5,spazzydee,0,li0mhj,,t3_li0mhj,7,0,0,the gender understander,,,,
1613154352,⡯⡯⡾⠝⠘⠀ ⠀⠀⠀⠀⠀⠀⠀⠀⠀⠀⠀⠀⠀⢊⠘⡮⣣⠪⠢⡑⡌ ㅤ ⠟⠝⠈⠀⠀⠀. ⠡⠀⠠⢈⠠⢐⢠⢂⢔⣐⢄⡂⢔⠀⡁⢉⠸⢨⢑⠕⡌ ㅤ ⠀ ⠀ ⡀⠁⠀⠀⠀⡀⢂⠡⠈⡔⣕⢮⣳⢯⣿⣻⣟⣯⣯⢷⣫⣆⡂ ⢐⠑⡌ ⢀⠠⠐⠈⠀⢀⢂⠢⡂⠕⡁⣝⢮⣳⢽⡽⣾⣻⣿⣯⡯⣟⣞⢾⢜⢆⠀⡀⠀⠪ ⣬⠂⠀⠀⢀⢂⢪⠨⢂⠥⣺⡪⣗⢗⣽⢽⡯⣿⣽⣷⢿⡽⡾⡽⣝⢎⠀⠀⠀⢡ ⣿⠀⠀⠀⢂⠢⢂⢥⢱⡹⣪⢞⡵⣻⡪⡯⡯⣟⡾⣿⣻⡽⣯⡻⣪⠧⠑⠀⠁⢐ ⣿⠀⠀⠀⠢⢑⠠⠑⠕⡝⡎⡗⡝⡎⣞⢽⡹⣕⢯⢻⠹⡹⢚⠝⡷⡽⡨⠀⠀⢔ ⣿⡯⠀⢈⠈⢄⠂⠂⠐⠀⠌⠠⢑⠱⡱⡱⡑⢔⠁⠀⡀⠐⠐⠐⡡⡹⣪⠀⠀⢘ ⣿⣽⠀⡀⡊⠀⠐⠨⠈⡁⠂⢈⠠⡱⡽⣷⡑⠁⠠⠑⠀⢉⢇⣤⢘⣪⢽⠀⢌⢎ ⣿⢾⠀⢌⠌⠀⡁⠢⠂⠐⡀⠀⢀⢳⢽⣽⡺⣨⢄⣑⢉⢃⢭⡲⣕⡭⣹⠠⢐⢗ ⣿⡗⠀⠢⠡⡱⡸⣔⢵⢱⢸⠈⠀⡪⣳⣳⢹⢜⡵⣱⢱⡱⣳⡹⣵⣻⢔⢅⢬⡷ ⣷⡇⡂⠡⡑⢕⢕⠕⡑⠡⢂⢊⢐⢕⡝⡮⡧⡳⣝⢴⡐⣁⠃⡫⡒⣕⢏⡮⣷⡟ ⣷⣻⣅⠑⢌⠢⠁⢐⠠⠑⡐⠐⠌⡪⠮⡫⠪⡪⡪⣺⢸⠰⠡⠠⠐⢱⠨⡪⡪⡰ ⣯⢷⣟⣇⡂⡂⡌⡀⠀⠁⡂⠅⠂⠀⡑⡄⢇⠇⢝⡨⡠⡁⢐⠠⢀⢪⡐⡜⡪⡊ ⣿⢽⡾⢹⡄⠕⡅⢇⠂⠑⣴⡬⣬⣬⣆⢮⣦⣷⣵⣷⡗⢃⢮⠱⡸⢰⢱⢸⢨⢌ ⣯⢯⣟⠸⣳⡅⠜⠔⡌⡐⠈⠻⠟⣿⢿⣿⣿⠿⡻⣃⠢⣱⡳⡱⡩⢢⠣⡃⠢⠁ ⡯⣟⣞⡇⡿⣽⡪⡘⡰⠨⢐⢀⠢⢢⢄⢤⣰⠼⡾⢕⢕⡵⣝⠎⢌⢪⠪⡘⡌⠀ ⡯⣳⠯⠚⢊⠡⡂⢂⠨⠊⠔⡑⠬⡸⣘⢬⢪⣪⡺⡼⣕⢯⢞⢕⢝⠎⢻⢼⣀⠀ ⠁⡂⠔⡁⡢⠣⢀⠢⠀⠅⠱⡐⡱⡘⡔⡕⡕⣲⡹⣎⡮⡏⡑⢜⢼⡱⢩⣗⣯⣟ ⢀⢂⢑⠀⡂⡃⠅⠊⢄⢑⠠⠑⢕⢕⢝⢮⢺⢕⢟⢮⢊⢢⢱⢄⠃⣇⣞⢞⣞⢾ ⢀⠢⡑⡀⢂⢊⠠⠁⡂⡐⠀⠅⡈⠪⠪⠪⠣⠫⠑⡁⢔⠕⣜⣜⢦⡰⡎⡯⡾⡽,comment,gn32ww0,transthrowaway17701,0,lif8c6,,t3_lif8c6,10,0,0,,,,,
1613156593,I fucking hate this LARP,comment,gn382a6,omnibean,0,lifas5,,t3_lifas5,8,0,0,🅱️oymoder,,,,
1613157179,This hurt to read holy fuck,comment,gn39ck3,Crit-Monkey,0,lifas5,,t3_lifas5,13,0,0,,,,,
1613157603,What the fuck,comment,gn3a9v2,[deleted],0,lifas5,,t3_lifas5,8,0,0,,,,,
1613162512,[deleted],comment,gn3l12t,[deleted],1,le7nus,,t3_le7nus,3,0,0,,,,,
1613164603,What is the /lgbt/ faction in civ 5,comment,gn3pjwj,Crit-Monkey,0,lfjvn9,,t3_lfjvn9,2,0,0,,,,,
1613170462,howohurty?,comment,gn41r21,Nova_of_Arcturus,0,lifas5,,t3_lifas5,2,0,0,,,,,
1613170902,"If one of you wants to repost this to r/ChasersRiseUp for free karma, you can do that. I'm banned so I can't share it there. Also, I did not make this meme.",comment,gn42mjg,Fentanya,0,lin58v,,t3_lin58v,14,0,0,Queen of this subreddit,,,,
1613183261,Love how the girl on the left just sat there for a full year,comment,gn4pe53,velocibirb,0,lin58v,,t3_lin58v,13,0,0,,,,,
1613183398,depression be like that,comment,gn4pmz4,Fentanya,0,lin58v,,t1_gn4pe53,18,0,0,Queen of this subreddit,,,,
1613183608,PSA: If you are attracted to trans girls. You should take the pink pill. Your future self will thank you.,comment,gn4q0mq,[deleted],0,lin58v,,t3_lin58v,18,0,0,,,,,
1613183953,accurate rep of hontra and abi,comment,gn4qn1i,lockedpain,0,lin58v,,t3_lin58v,18,0,0,,,,,
1613184215,"i saw this get posted and its genuinely one of the most schizo things ive seen in the past month, while i believe agps do exist quite obviously this shit is just too much. youre adding so much shit to blanchards typology that its just becoming speculation lmao",comment,gn4r3mc,lockedpain,0,liok6h,,t3_liok6h,9,0,0,,,,,
1613184706,[Philosophy moment](https://www.reddit.com/r/4tran/comments/lbo1un/conspiracy_anon_is_funny_also_gets_trips/),comment,gn4ryi7,Fentanya,0,lin58v,,t1_gn4qn1i,5,0,0,Queen of this subreddit,,,,
1613209788,Where does one meet a girl like this...... Asking for a friend of course.,comment,gn6c385,mosquitoiv,0,liuyy9,,t3_liuyy9,13,0,0,edit this,,,,
1613222013,"It was always just speculation tho. The whole axiom on which the typology rests, that attraction to women is a male sexuality and attraction to men is a female sexuality, is just so far into bunk for so many reasons that I'm really surprised anyone took it seriously.",comment,gn7gat0,UnchainedMundane,0,liok6h,,t1_gn4r3mc,4,0,0,,,,,
1613222592,"""philosophytube is an egg""

some people have a really well-attuned tran-dar (and congrats to Abby!)",comment,gn7inqy,UnchainedMundane,0,lfjvn9,,t3_lfjvn9,16,0,0,,,,,
1613223425,how make baby. how make baby if wrong? how life still here?,comment,gn7lu19,lockedpain,0,liok6h,,t1_gn7gat0,2,0,0,,,,,
1613223569,"""gay"" and ""straight"" aren't the only possible sexualities, and you can be cis and gay

unless?",comment,gn7m9xo,UnchainedMundane,0,liok6h,,t1_gn7lu19,2,0,0,,,,,
1613226886,you cant! tops are straight and bottoms are women.,comment,gn7x1q3,lockedpain,0,liok6h,,t1_gn7m9xo,2,0,0,,,,,
1613227058,this is all greek to me,comment,gn7xkud,UnchainedMundane,0,liok6h,,t1_gn7x1q3,1,0,0,,,,,
1613233665,[deleted],comment,gn8l8fk,[deleted],1,liok6h,,t1_gn7gat0,1,0,0,,,,,
1613233919,OwO I could feel my bwain cewws kiwwing themsewves one by one uwu desuuuuuuu,comment,gn8m8lo,theripoffartist,0,lifas5,,t3_lifas5,5,0,0,AGP BDD ABCDEFG,,,,
1613234469,"The corollary to that is that the vast majority of trans people aren't bisexual or asexual, which is simply not true.

Also I don't think it was implied by Blanchard to be a fetish. Instead it was a heterosexual male sexuality finding its object of desire in the person themselves (""erotic target location error""). A fetish would be sexually enjoying the act, while his theories proposed that the sexual element comes from the attraction not to the act but to the woman they have become.

(Btw, ""GayGP""? If you're a woman and desire sex with men that's hetero. If you don't consider yourself a woman are you transgender or something else? Or is there this huge community of people who transition for purely sexual reasons that I never knew about)",comment,gn8obyn,UnchainedMundane,0,liok6h,,t1_gn8l8fk,2,0,0,,,,,
1613234885,borderlands 2 reference?,comment,gn8px26,Fentanya,0,lifas5,,t1_gn8m8lo,2,0,0,Queen of this subreddit,,,,
1613235264,[deleted],comment,gn8rdi1,[deleted],1,liok6h,,t1_gn8obyn,1,0,0,,,,,
1613242538,Hawt,comment,gn9lgoo,[deleted],0,liuyy9,,t3_liuyy9,2,0,0,,,,,
1613244882,discord,comment,gn9sz6w,Fentanya,0,liuyy9,,t1_gn6c385,4,0,0,Queen of this subreddit,,,,
1613246114,[deleted],comment,gn9yvlm,[deleted],1,lecf6m,,t3_lecf6m,2,0,0,,,,,
1613249197,oh boy,comment,gnabzek,yosh_yosh_yosh_yosh,0,liuyy9,,t3_liuyy9,2,0,0,,,,,
1613252279,Tag yourself.  I'm big trans.,comment,gnaoz46,CIA_grade_LSD,0,lj8lf1,,t3_lj8lf1,5,0,0,,,,,
1613252395,I'm femboy respectors 😏😳,comment,gnapebc,theydystardust,0,lj8lf1,,t1_gnaoz46,4,0,0,,,,,
1613259887,[deleted],comment,gnbhrpu,[deleted],1,liok6h,,t1_gn4r3mc,1,0,0,,,,,
1613261124,I'm defo the one in the chair.,comment,gnblcmd,Finn900mc,0,lj8lf1,,t1_gnapebc,5,0,0,,,,,
1613265798,i'm the big trans' fingernails,comment,gnbwat4,theripoffartist,0,lj8lf1,,t1_gnblcmd,3,0,0,AGP BDD ABCDEFG,,,,
1613266684,heck I posted this too. I’ll delete mine,comment,gnbywbq,Fentanya,0,ljd3ah,,t3_ljd3ah,10,0,0,Queen of this subreddit,,,,
1613268121,I want him to misgender me 😳,comment,gnc2oi9,Princess_Bugaboo,0,ljd3ah,,t3_ljd3ah,12,0,0,,,,,
1613280690,"that last response is cringe lol, is that what you're referring to

am i learning now that you are not based",comment,gncx9yz,yosh_yosh_yosh_yosh,0,ljdjaf,,t3_ljdjaf,4,0,0,,,,,
1613313619,I'm the femboy indoctrination machine,comment,gnes265,[deleted],0,lj8lf1,,t1_gnbwat4,3,0,0,,,,,
1613321922,I want him to call me an AGP fetishist and tell me I’ll never pass because I’m not HSTS 😳,comment,gnfpehr,theripoffartist,0,ljd3ah,,t1_gnc2oi9,8,0,0,AGP BDD ABCDEFG,,,,
1613324688,[deleted],comment,gng2l4c,[deleted],1,ljd3ah,,t1_gnfpehr,8,0,0,,,,,
1613345980,i’m `c u b e`,comment,gnh9b0p,QueenOfTransStyle,0,lj8lf1,,t1_gnes265,3,0,0,,,,,
1613366315,greentexts that are just thinly veiled erotica are da best,comment,gni7zmh,wednesday--,0,lk5ywk,,t3_lk5ywk,40,0,0,a happy boymoder,,,,
1613370397,stopped reading at youngshit. don't need to seethe anymore tonight,comment,gnidoza,theripoffartist,0,lk5ywk,,t3_lk5ywk,18,0,0,AGP BDD ABCDEFG,,,,
1613377412,[deleted],comment,gnilxq2,[deleted],1,ljxcl8,,t3_ljxcl8,3,0,0,,,,,
1613396936,I'm so proud my post got posted here u.u,comment,gnj82xk,red99succubus,0,lk5ywk,,t3_lk5ywk,14,0,0,,,,,
1613396948,"Hi so proud my post got posted here u, I'm Dad! :)",comment,gnj83kt,dadbot_3000,0,lk5ywk,,t1_gnj82xk,4,0,0,,,,,
1613403066,Relatable,comment,gnjigqt,[deleted],0,lk5ywk,,t1_gnidoza,4,0,0,,,,,
1613405433,"no, I'm referring to the post, that gay TERFs are jealous. Obviously the last response is tranphobic cringe.",comment,gnjn2b3,Fentanya,0,ljdjaf,,t1_gncx9yz,1,0,0,Queen of this subreddit,,,,
1613423126,God I love 4chan erotica. We should make a subreddit for it 😜,comment,gnko7dh,reallyaveragejo,0,lk5ywk,,t3_lk5ywk,6,0,0,uwu so heckin valid,,,,
1613423327,Ok I just learned new new word,comment,gnkomg3,mosquitoiv,0,lkgoi7,,t3_lkgoi7,5,0,0,edit this,,,,
1613425610,ok good lol,comment,gnktbys,yosh_yosh_yosh_yosh,0,ljdjaf,,t1_gnjn2b3,3,0,0,,,,,
1613428375,"here's another one for you: 

anon wants a poz load in her **neghole**",comment,gnkyx3e,Fentanya,0,lkgoi7,,t1_gnkomg3,7,0,0,Queen of this subreddit,,,,
1613443923,lmk if you do I saw a good one on /d/ the other day,comment,gnlsigx,kotoktet,0,lk5ywk,,t1_gnko7dh,2,0,0,,,,,
1613454527,[deleted],comment,gnmaaey,[deleted],1,ljd3ah,,t3_ljd3ah,7,0,0,,,,,
1613465941,Lol brilliant,comment,gnmnv85,mosquitoiv,0,lkgoi7,,t1_gnkyx3e,2,0,0,edit this,,,,
1613493855,r/The_Donald probably,comment,gnnuopi,Jimmy_McGill_8-13-01,0,ll7kiw,,t3_ll7kiw,12,0,0,,,,,
1613498389,[/r/traandwagon ](https://www.reddit.com/r/traandwagon/) ?,comment,gno51lt,TrueFun,0,ll7kiw,,t3_ll7kiw,1,0,0,,,,,
1613500294,"we could create it. And with that name, it’s not just enbyposting, making it more dynamic. It could last for all the future meme trends on /lgbt/",comment,gno9ep6,Fentanya,0,ll7kiw,,t1_gno51lt,2,0,0,Queen of this subreddit,,,,
1613501944,kek,comment,gnod7va,theripoffartist,0,ll7kiw,,t1_gnnuopi,5,0,0,AGP BDD ABCDEFG,,,,
1613505490,"wait nevermind, this sub already exists? And it's not what I was looking for? Damn.",comment,gnol2rt,Fentanya,0,ll7kiw,,t1_gno51lt,3,0,0,Queen of this subreddit,,,,
1613523447,[removed],comment,gnpn6g6,[deleted],1,lk5ywk,,t3_lk5ywk,3,0,0,,,,,
1613527518,Based enby,comment,gnpv0j0,Princess_Bugaboo,0,llc77q,,t3_llc77q,6,0,0,,,,,
1613549329,Heckin cute and valid enbypilled,comment,gnquaza,Late2thePunch,0,llc77q,,t3_llc77q,6,0,0,edit this,,,,
1613551155,Why are examples of enby ppl always so fem,comment,gnqw8xi,earears,0,llc77q,,t3_llc77q,3,0,0,,,,,
1613582195,Mind size: MEGA,comment,gns8k9n,Late2thePunch,0,llxr34,,t3_llxr34,6,0,0,edit this,,,,
1613588150,not a bad strategy,comment,gnsmozc,OfficialGami,0,llxr34,,t3_llxr34,4,0,0,,,,,
1613591153,ahaha what,comment,gnstei1,confusion-ina-can,0,li0mhj,,t3_li0mhj,3,0,0,,,,,
1613606095,"&gt;tfw white joker

it is over",comment,gntr967,theripoffartist,0,llzzbm,,t3_llzzbm,5,0,0,AGP BDD ABCDEFG,,,,
1613606564,sounds kinda cute desu,comment,gnts6px,theripoffartist,0,lm88ur,,t3_lm88ur,7,0,0,AGP BDD ABCDEFG,,,,
1613609275,"""noooooo you can't be aroused by your own body. as a true transexual your existence must be persistently predicated upon suffering and heart-rending anguish""

haha agp go ~~brrrrr~~ hnnnnng~ :3",comment,gntxjfi,wednesday--,0,lm88ur,,t3_lm88ur,11,0,0,a happy boymoder,,,,
1613609403,Based!,comment,gntxskt,Fentanya,0,lm88ur,,t1_gntxjfi,8,0,0,Queen of this subreddit,,,,
1613610005,Good riddance 🥰❤️✨,comment,gntyzor,Princess_Bugaboo,0,lm82lj,,t3_lm82lj,12,0,0,,,,,
1613614472,fuckinnnnnnnnnnnnn what?,comment,gnu80hi,QueenOfTransStyle,0,lm82lj,,t3_lm82lj,6,0,0,,,,,
1613617263,F,comment,gnudn2y,theripoffartist,0,lm82lj,,t3_lm82lj,4,0,0,AGP BDD ABCDEFG,,,,
1613625960,Larp,comment,gnutbua,[deleted],0,lm8fv3,,t3_lm8fv3,9,0,0,,,,,
1613626305,"This physically fucking hurts to look at. Why the fuck do old hons act so fucking weird. Just take a look on reddit and they are so fucking weird. ""I'm taking c acetat which is used to castrate rapists"" why did you have to fucking say that, good for you, you're probably not that far from being a rapist anyways. ""I want hrt but my dick will stop working"" well maybe you shouldn't be in it in the first fucking place. ""I love being a sexy girl"" *looks at profile* yeah you're fucking 60 years old and looks like a overweight quarterback what the fuck kind of cope gives you that kind of confidence.",comment,gnutv68,[deleted],0,lme53o,,t3_lme53o,18,0,0,,,,,
1613626317,"**Hello.**

I noticed you dropped 8 f-bombs in this comment. This might be necessary, but using nicer language makes the whole world a better place.

Maybe you need to blow off some steam - in which case, go get a drink of water and come back later. This is just the internet and sometimes it can be helpful to cool down for a second.

***

^I ^am ^a ^bot. ^❤❤❤ ^| **--&gt; ^[SEPTEMBER](https://redd.it/ipsjip) ^[UPDATE](https://redd.it/ipsjip) &lt;--**",comment,gnutvvw,CoolDownBot,0,lme53o,,t1_gnutv68,7,0,0,,,,,
1613626340,"
Fuck Off CoolDownBot Do you not fucking understand that the fucking world is fucking never going to fucking be a perfect fucking happy place? Seriously, some people fucking use fucking foul language, is that really fucking so bad? People fucking use it for emphasis or sometimes fucking to be hateful. It is never fucking going to go away though. This is fucking just how the fucking world, and the fucking internet is. Oh, and your fucking PSA? Don't get me fucking started. Don't you fucking realize that fucking people can fucking multitask and fucking focus on multiple fucking things? People don't fucking want to focus on the fucking important shit 100% of the fucking time. Sometimes it's nice to just fucking sit back and fucking relax. Try it sometimes, you might fucking enjoy it. I am a bot",comment,gnutx60,FuckCoolDownBot2,0,lme53o,,t1_gnutvvw,16,0,0,,,,,
1613635350,"&gt;Emily Hasadickinson

I laughed.",comment,gnv5mka,Questioning-Alt,0,lmfci8,,t3_lmfci8,13,0,0,,,,,
1613635723,No doubt,comment,gnv61it,Crit-Monkey,0,lm8fv3,,t1_gnutbua,2,0,0,,,,,
1613636709,This is a great one for r/terfpoems,comment,gnv74ps,mosquitoiv,0,lmfci8,,t3_lmfci8,10,0,0,edit this,,,,
1613642625,[deleted],comment,gnvddfp,[deleted],1,lm82lj,,t3_lm82lj,2,0,0,,,,,
1613650967,Shooved,comment,gnvmxoc,xlFLASHl,0,lmfci8,,t3_lmfci8,6,0,0,,,,,
1613660115,[deleted],comment,gnw2l19,[deleted],1,lm82lj,,t3_lm82lj,6,0,0,,,,,
1613671449,jesus this was too real man :(,comment,gnwt1fl,theripoffartist,0,lmshuu,,t3_lmshuu,15,0,0,AGP BDD ABCDEFG,,,,
1613686767,"&gt; the Saxon

The original poem is literally ""when the English began to hate,"" fucking Yanks need to read a book.",comment,gnxtizi,SongOTheGolgiBoatmen,0,lmfci8,,t3_lmfci8,5,0,0,,,,,
1613690727,[deleted],comment,gny1x3n,[deleted],1,lme53o,,t1_gnutx60,3,0,0,,,,,
1613699223,That's uhhhhhh pretty fuckin cringe,comment,gnyinpq,Crit-Monkey,0,lmsuu8,,t3_lmsuu8,8,0,0,,,,,
1613699227,pain,comment,gnyio2r,sneakygingertroll,0,ln0fes,,t3_ln0fes,8,0,0,,,,,
1613699960,i wanna get tranny bangs so i can malefail more but i also don't wanna look like an obvious weird faggot. guess i'll stick with my 5Head exposing part that i've got now sigh,comment,gnyk1z2,theripoffartist,0,lmzoke,,t3_lmzoke,18,0,0,AGP BDD ABCDEFG,,,,
1613702334,[removed],comment,gnyol2i,[deleted],1,lmzoke,,t3_lmzoke,4,0,0,,,,,
1613702753,[removed],comment,gnypdx6,[deleted],1,llxr34,,t3_llxr34,2,0,0,,,,,
1613704705,[deleted],comment,gnyt16y,[deleted],1,lmzoke,,t1_gnyk1z2,8,0,0,,,,,
