timestamp,text,type,id,author,is_deleted,submission_id,submission_title,parent_id,score,controversiality,gilded,author_flair_text,link_flair_text,is_self,url,domain
1607649890,"If this is the body you want, I'd say go for it.",comment,gfcenci,Fentanya,0,kacnsz,,t3_kacnsz,3,0,0,Queen of this subreddit,,,,
1607788077,That’s just plain unfortunate.,comment,gfjh8w0,Cheezefemboyo1,0,kboac7,,t3_kboac7,4,0,0,,,,,
1607795889,not to be a degenerate but i love topping and hate having a dick so like I'd do this,comment,gfk4pc8,HufflepuffIronically,0,kboac7,,t1_gfjh8w0,8,0,0,,,,,
1607797297,A bit comical but you do you,comment,gfk8xh2,TranstrasserismNow,0,kboac7,,t1_gfk4pc8,2,0,0,☣️ROGD BIOWEAPON CARRIER☣️👸🏼,,,,
1607807443,"Strap-ons &gt; flesh dicks 99% of the time. A strap-on can’t cause an accidental pregnancy, won’t go soft on you, and can be swapped out in order to provide the ideal size and shape depending on the bottom’s desires.

Cis men should top using strap-ons.",comment,gfl4b5n,velocibirb,0,kboac7,,t3_kboac7,9,0,0,,,,,
1607810167,mandatory SRS for all cis men when,comment,gflcpvg,TranstrasserismNow,0,kboac7,,t1_gfl4b5n,12,0,0,☣️ROGD BIOWEAPON CARRIER☣️👸🏼,,,,
1607866062,Five years and her dad never saw her naked?,comment,gfoxjwa,[deleted],0,kby2y8,,t3_kby2y8,3,0,0,,,,,
1607866269,Possible if youre insecure about your body,comment,gfoy1io,TranstrasserismNow,0,kby2y8,,t1_gfoxjwa,2,0,0,☣️ROGD BIOWEAPON CARRIER☣️👸🏼,,,,
1607935527,Ouch.,comment,gfsn0r5,Cheezefemboyo1,0,kcrrhv,,t3_kcrrhv,1,0,0,,,,,
1607963598,"I don't know if this is a true story, but WOW! Convincing a TERFy mom to let their 12 year old transition has gotta be one of the hardest achievements in the game.",comment,gftp3x8,Fentanya,0,kcykew,,t3_kcykew,19,0,0,Queen of this subreddit,,,,
1607964161,Admirable but if I was anon I would have roped afterwards,comment,gftq9ja,TranstrasserismNow,0,kcykew,,t1_gftp3x8,16,0,0,☣️ROGD BIOWEAPON CARRIER☣️👸🏼,,,,
1607964970,"well, at least anon could die a hero. She saved this young tranner from a similar fate.",comment,gftrxqg,Fentanya,0,kcykew,,t1_gftq9ja,13,0,0,Queen of this subreddit,,,,
1607967185,Braver than the troops o7 we salute our hon troopers,comment,gftwl9c,TranstrasserismNow,0,kcykew,,t1_gftrxqg,9,0,0,☣️ROGD BIOWEAPON CARRIER☣️👸🏼,,,,
1607983388,That's kinda soul-crushing 😐,comment,gfuurzl,Crit-Monkey,0,kcykew,,t3_kcykew,13,0,0,,,,,
1607983557,"I think I'd be completely unable to cope tbh

Fuck this world",comment,gfuv47a,TranstrasserismNow,0,kcykew,,t1_gfuurzl,7,0,0,☣️ROGD BIOWEAPON CARRIER☣️👸🏼,,,,
1607983650,Just curious what's considered a youngshit?,comment,gfuvayp,Crit-Monkey,0,kcykew,,t1_gfuv47a,3,0,0,,,,,
1607983781,"To me youngshit is starting blockers or hrt at 16 or below

But I imagine to older people everyone younger than them is a youngshit, I've seen 19 year olds and such called youngshits lool",comment,gfuvkf2,TranstrasserismNow,0,kcykew,,t1_gfuvayp,6,0,0,☣️ROGD BIOWEAPON CARRIER☣️👸🏼,,,,
1607983862,Yeah lmao I think I was blessed with good genes cause I started at 18 but still fet called a youngshit and I'm like 😶😐😑,comment,gfuvqg8,Crit-Monkey,0,kcykew,,t1_gfuvkf2,2,0,0,,,,,
1607983943,"Everyone is a youngshit to someone, in a way 18 is still young",comment,gfuvwbm,TranstrasserismNow,0,kcykew,,t1_gfuvqg8,1,0,0,☣️ROGD BIOWEAPON CARRIER☣️👸🏼,,,,
1608015236,"[78% of trans women in the US transition after 25 (pg 26).](https://www.thetaskforce.org/injustice-every-turn-report-national-transgender-discrimination-survey/) so, I say anyone under 25. 

The internet skews younger, but the real world is different.",comment,gfweh9r,yosh_yosh_yosh_yosh,0,kcykew,,t1_gfuvayp,5,0,0,,,,,
1608016229,Is there hope for youngshits who turned into twinkhons like me?,comment,gfwfm2k,omnibean,0,kcykew,,t1_gfuvkf2,3,0,0,🅱️oymoder,,,,
1608021942,Big question is who's the instructor O\_O O\_O O\_O,comment,gfwln9n,TranstrasserismNow,0,kdfpz5,,t3_kdfpz5,5,0,0,☣️ROGD BIOWEAPON CARRIER☣️👸🏼,,,,
1608022454,"Definitely, we all like to be overly pessimistic, but the reality is that all but the most unfortunate of us (Like heroic anon) are going to make it, and we have so many years of technological progress ahead that it's likely going to get so much easier than it is now",comment,gfwm5a2,TranstrasserismNow,0,kcykew,,t1_gfwfm2k,5,0,0,☣️ROGD BIOWEAPON CARRIER☣️👸🏼,,,,
1608023134,"Wow, that statistic is true?",comment,gfwmsyj,TranstrasserismNow,0,kcykew,,t1_gfweh9r,2,0,0,☣️ROGD BIOWEAPON CARRIER☣️👸🏼,,,,
1608024308,yep!,comment,gfwnwre,yosh_yosh_yosh_yosh,0,kcykew,,t1_gfwmsyj,2,0,0,,,,,
1608024444,Goess to show just how fortunate so many of us really are,comment,gfwo1bw,TranstrasserismNow,0,kcykew,,t1_gfwnwre,2,0,0,☣️ROGD BIOWEAPON CARRIER☣️👸🏼,,,,
1608024497,"absolutely, yeah.",comment,gfwo34i,yosh_yosh_yosh_yosh,0,kcykew,,t1_gfwo1bw,2,0,0,,,,,
1608043959,this is some god-tier trannyposting,comment,gfxbnex,Fentanya,0,kdfpz5,,t3_kdfpz5,5,0,0,Queen of this subreddit,,,,
1608057891,Probably because he's only made a couple videos about transmedicalism and then shut the fuck up about while most of his recent content has been all about roasting and mocking transphobes.,comment,gfy4g3g,Fentanya,0,kdqaib,,t3_kdqaib,15,0,0,Queen of this subreddit,,,,
1608061130,"fake, there are only two trans youtube channels on the entire ether webs",comment,gfybpy5,im--stuff,0,kdqaib,,t1_gfy4g3g,8,0,0,,,,,
1608098386,We must secure the existence of our people and a future for trans children,comment,gg082cc,Fentanya,0,kdmyu0,,t3_kdmyu0,2,0,0,Queen of this subreddit,,,,
1608119162,"eugh

i hate the diaper meme so deeply",comment,gg0u1op,yosh_yosh_yosh_yosh,0,ke6cxg,,t3_ke6cxg,9,0,0,,,,,
1608119423,Worst thing to happen to the board except the disappearance of the wheelhouse,comment,gg0ubfn,TranstrasserismNow,0,ke6cxg,,t1_gg0u1op,3,0,0,☣️ROGD BIOWEAPON CARRIER☣️👸🏼,,,,
1608137651,Are gaslighters pinkpillers in this case?,comment,gg1o2jy,jidlar,0,ke6ac1,,t3_ke6ac1,8,0,0,,,,,
1608138322,ye,comment,gg1pgzo,TranstrasserismNow,0,ke6ac1,,t1_gg1o2jy,2,0,0,☣️ROGD BIOWEAPON CARRIER☣️👸🏼,,,,
1608139983,"I can imagine a wealthy middle aged british woman beckoning me to ""take the pinkpill""",comment,gg1syl4,im--stuff,0,ke6ac1,,t1_gg1o2jy,6,0,0,,,,,
1608144749,how it feels to chew 3 hrt,comment,gg2351l,TranstrasserismNow,0,kef654,,t3_kef654,10,0,0,☣️ROGD BIOWEAPON CARRIER☣️👸🏼,,,,
1608144800,Stimulate your AGP,comment,gg23944,Crit-Monkey,0,kef654,,t1_gg2351l,8,0,0,,,,,
1608145758,"Charlotte is taking on a the noble cause of saving the trans zoomers from repressing so they don’t become hons like her. For that, I salute her. o7",comment,gg25b3w,Fentanya,0,ke7ttk,,t3_ke7ttk,8,0,0,Queen of this subreddit,,,,
1608147111,She better use the new educational position to introduce Hormonology to biology class extra early,comment,gg2881n,TranstrasserismNow,0,ke7ttk,,t1_gg25b3w,6,0,0,☣️ROGD BIOWEAPON CARRIER☣️👸🏼,,,,
1608165248,upvote bc r/PCM users,comment,gg38ny2,spykids70,0,kef654,,t1_gg23944,6,0,0,,,,,
1608230567,Sounds like a larp ngl,comment,gg60rb8,Crit-Monkey,0,keu07r,,t3_keu07r,7,0,0,,,,,
1608230653,probably. but a good one!,comment,gg60y07,TranstrasserismNow,0,keu07r,,t1_gg60rb8,6,0,0,☣️ROGD BIOWEAPON CARRIER☣️👸🏼,,,,
1608230773,"True half the larps are ""nyaaa I got boyremoved"" with mild differences and those get on my nerves",comment,gg6174r,Crit-Monkey,0,keu07r,,t1_gg60y07,7,0,0,,,,,
1608230819,We need more creative writing,comment,gg61aoh,TranstrasserismNow,0,keu07r,,t1_gg6174r,2,0,0,☣️ROGD BIOWEAPON CARRIER☣️👸🏼,,,,
1608236535,"\&gt; be a troon

\&gt; go to gym

\&gt; see a penis inspection day sign

\&gt; try to leave

\&gt; the door is already sealed",comment,gg6d5xv,jidlar,0,kf3g58,,t3_kf3g58,10,0,0,,,,,
1608257685,thanks mom,comment,gg7i69e,Juuliyuh,0,kfbvoy,,t3_kfbvoy,5,0,0,racist femboy,,,,
1608257725,"Weird flex, but okay.",comment,gg7i8u3,Fentanya,0,keu07r,,t3_keu07r,3,0,0,Queen of this subreddit,,,,
1608257777,You're welcome.,comment,gg7ic64,Fentanya,0,kfbvoy,,t1_gg7i69e,3,0,0,Queen of this subreddit,,,,
1608260237,I see you still haven't flaired up yet,comment,gg7mq9q,Fentanya,0,kfbvoy,,t1_gg7i69e,3,0,0,Queen of this subreddit,,,,
1608263766,&gt;gets boyremoved by inspector chad,comment,gg7t0kn,Tri_Solar_Day,0,kf3g58,,t1_gg6d5xv,7,0,0,,,,,
1608267217,is this better UwU,comment,gg7z050,Juuliyuh,0,kfbvoy,,t1_gg7mq9q,3,0,0,racist femboy,,,,
1608268458,"yes, now present that Strasserist bussy to an Aryan stud",comment,gg80wl1,Fentanya,0,kfbvoy,,t1_gg7z050,5,0,0,Queen of this subreddit,,,,
1608283729,Ok now this is Est-pic,comment,gg8iwzw,TranstrasserismNow,0,kfbvoy,,t3_kfbvoy,2,0,0,☣️ROGD BIOWEAPON CARRIER☣️👸🏼,,,,
1608297216,what does it say in the corner,comment,gg8xdet,HufflepuffIronically,0,kfi799,,t3_kfi799,4,0,0,,,,,
1608297551,"[https://imgur.com/a/ucqICXC](https://imgur.com/a/ucqICXC)

got it for you",comment,gg8xu35,TranstrasserismNow,0,kfi799,,t1_gg8xdet,5,0,0,☣️ROGD BIOWEAPON CARRIER☣️👸🏼,,,,
1608303677,Word.,comment,gg97y96,Late2thePunch,0,kfbvoy,,t3_kfbvoy,2,0,0,edit this,,,,
1608338771,"Important point: it does make a difference to leave. A big one. 

Made my life infinitely better. No one on /lgbt/ has any idea what they're talking about, and there's this persistent meanness and aura of horrifying depression that is not neutral in any way. It constantly brings you down until you leave.",comment,ggbacjs,yosh_yosh_yosh_yosh,0,kfwslb,,t3_kfwslb,14,0,0,,,,,
1608453542,[deleted],comment,gggfemv,[deleted],1,kfi799,,t1_gg8xu35,1,0,0,,,,,
1608530197,Borderline Personality Disorder is a hell of a drug,comment,ggk88gm,Dungeonyoga,0,khaexg,,t3_khaexg,10,0,0,,,,,
1608531147,Time to take the pinkpill Alice.,comment,ggk9g5f,[deleted],0,khaexg,,t3_khaexg,13,0,0,,,,,
1608580028,Burn the whole thread,comment,ggm7h7q,Crit-Monkey,0,khaexg,,t3_khaexg,7,0,0,,,,,
1608787669,"Link, of course: https://drive.google.com/file/d/1uGcAPB2qNYJnXy24P_1B5rCQILet6f0Q/view?usp=sharing",comment,ggvh0w1,agpthrowaway555,0,kj9gfs,,t3_kj9gfs,3,0,0,,,,,
1608793577,I'm a lil afraid lol,comment,ggvoa3q,yosh_yosh_yosh_yosh,0,kj9gfs,,t1_ggvh0w1,6,0,0,,,,,
1608794152,Why?,comment,ggvowlt,[deleted],0,kj9gfs,,t1_ggvh0w1,2,0,0,,,,,
1608990399,"&gt; Trans girls around me aren't lesbians


&gt; transbian don't exist",comment,gh2kd52,[deleted],0,kkit8j,,t3_kkit8j,18,0,0,,,,,
1609004599,So wait are 90% of trans women lesbians in denial or straights in denial? Someone please clarify,comment,gh35g3c,Kalvin-TL,0,kkit8j,,t3_kkit8j,4,0,0,,,,,
1609005336,just believe people when they tell you what sexuality they are lmao,comment,gh36ppd,yosh_yosh_yosh_yosh,0,kkit8j,,t1_gh35g3c,9,0,0,,,,,
1609005364,(Wassa joke),comment,gh36rfs,Kalvin-TL,0,kkit8j,,t1_gh36ppd,3,0,0,,,,,
1609005578,"lol sorry, /lgbt/ has scarred me into taking you seriously",comment,gh374oy,yosh_yosh_yosh_yosh,0,kkit8j,,t1_gh36rfs,8,0,0,,,,,
1609011269,4chan is brain poison lmao,comment,gh3hgrj,Kalvin-TL,0,kkit8j,,t1_gh374oy,7,0,0,,,,,
1609017387,yes,comment,gh3rw7g,yosh_yosh_yosh_yosh,0,kkit8j,,t1_gh3hgrj,2,0,0,,,,,
1609019928,[removed],comment,gh3w64r,[deleted],1,kkit8j,,t3_kkit8j,5,0,0,,,,,
1609027752,But transbians are men! 1!1!1!1!111! /s,comment,gh49het,[deleted],0,kkit8j,,t1_gh3w64r,2,0,0,,,,,
1609305157,"wholesome 4tran wtf

i mean its a nice change from the usual stuff but",comment,ghgzn7s,capo-gekko,0,kmppom,,t3_kmppom,8,0,0,,,,,
1609307413,&lt;3 emilia,comment,ghh2yoq,yosh_yosh_yosh_yosh,0,kmppom,,t3_kmppom,6,0,0,,,,,
1609308406,"I’m actually really glad I can’t have kids, and it makes me love bejng inseminated even more. I don’t want kids.",comment,ghh4bgk,Fentanya,0,kkit8j,,t3_kkit8j,3,0,0,Queen of this subreddit,,,,
1609321630,That post made me feel extremely uwu and I appreciate it!,comment,ghhijna,NotQuiteJessica,0,kmppom,,t3_kmppom,4,0,0,,,,,
1609329511,❤️,comment,ghhq8ek,Fentanya,0,kmppom,,t1_ghhijna,2,0,0,Queen of this subreddit,,,,
1609356321,Why are people so mean to Emilia when she is just trying to brighten their life up?,comment,ghj00om,[deleted],0,kmppom,,t1_ghhq8ek,3,0,0,,,,,
1609367974,There's just this hatred of positivity you see in a lot of people on /tttt/. It's really sad.,comment,ghjnewl,Fentanya,0,kmppom,,t1_ghj00om,2,0,0,Queen of this subreddit,,,,
1609556331,"Just do it though, the less cis men in the world the better. /s",comment,ghsfxmb,[deleted],0,kop9gb,,t3_kop9gb,13,0,0,,,,,
1609562476,[removed],comment,ghsqpwj,[deleted],1,kop9gb,,t3_kop9gb,6,0,0,,,,,
1609563112,"Ha! I've never had a girlfriend as a boy!
Now I still don't have a girlfriend as a girl, but that's uncertain, it can still increase.
So, in conclusion girls will &lt;= love me as a girl than as a boy!
(literally what half of the anecdotal evidence on reddit sounds like)",comment,ghsrrjw,[deleted],0,kop9gb,,t1_ghsqpwj,7,0,0,,,,,
1609563158,[removed],comment,ghsru61,[deleted],1,kop9gb,,t1_ghsrrjw,7,0,0,,,,,
1609563357,UwU looks like I'm fembrained! Good to know I'll make the perfect tradwife!,comment,ghss5fk,[deleted],0,kop9gb,,t1_ghsru61,9,0,0,,,,,
1609565585,"and I'm incapable at loving men, so I'm perfect to be a straight woman, even if I can't cook and all I know is mcdonalds, twerk, charge they phone, be bisexual, eat hot chip, and lie. Are all ""straight"" women bisexual?",comment,ghsvjry,Fentanya,0,kop9gb,,t3_kop9gb,8,0,0,Queen of this subreddit,,,,
1609567958,if all wonemn know is charge they phone why is my phone always 2% battery,comment,ghsysx1,yosh_yosh_yosh_yosh,0,kop9gb,,t1_ghsvjry,7,0,0,,,,,
1609579722,[deleted],comment,ghtbcpj,[deleted],1,kosibu,,t3_kosibu,1,0,0,,,,,
1609579779,why does the date say 12/32/20?,comment,ghtbeoc,Year_2038_Problem,0,kosibu,,t3_kosibu,9,0,0,,,,,
1609580031,[deleted],comment,ghtbn52,[deleted],1,kotgry,,t3_kotgry,4,0,0,,,,,
1609580177,I’ve found eyeliner to be incredibly helpful,comment,ghtbrz8,Fentanya,0,kotgry,,t1_ghtbn52,2,0,0,Queen of this subreddit,,,,
1609580363,[deleted],comment,ghtby1j,[deleted],1,kotgry,,t1_ghtbrz8,3,0,0,,,,,
1609588270,[removed],comment,ghtj8lz,[deleted],1,kotgry,,t3_kotgry,5,0,0,,,,,
1609606541,monkaS,comment,ghu9c0f,yosh_yosh_yosh_yosh,0,kosibu,,t1_ghtbeoc,9,0,0,,,,,
1609614341,Haha yes gender affirming human sex trafficking,comment,ghuom1y,Citrus_Shell,0,kosibu,,t3_kosibu,12,0,0,,,,,
1609697840,Someone should take this post and put it over the “mental gymnastics” meme.,comment,ghz6v4j,TransBoyTobias,0,kppflu,,t3_kppflu,10,0,0,ftm hands wrote this,,,,
1609697872,they should,comment,ghz6xlg,Fentanya,0,kppflu,,t1_ghz6v4j,4,0,0,Queen of this subreddit,,,,
1609703100,the virgin “I have to go through intense mental gymnastics to justify liking someone” vs the chad “I’m straight so whatever makes my dick hard is a woman”,comment,ghzib27,Juuliyuh,0,kppflu,,t1_ghz6xlg,7,0,0,racist femboy,,,,
1609716387,[removed],comment,gi0b74f,[deleted],1,kppflu,,t3_kppflu,7,0,0,,,,,
1609717109,Cancelling FFS right now to go buy high-waisted pants. Didn’t realize that fixing my brow ridge could be this cheap!,comment,gi0cqk3,millionaireDegen,0,kpsh9v,,t3_kpsh9v,8,0,0,,,,,
1609727826,"I’ve said it before and I’ll say it again, makeup is the tranner’s best friend.",comment,gi0yb6w,Fentanya,0,kpsh9v,,t3_kpsh9v,9,0,0,Queen of this subreddit,,,,
1609739083,How do you know what to get first? I don't know where to start.,comment,gi1i7yv,[deleted],0,kpsh9v,,t1_gi0yb6w,8,0,0,,,,,
1609771777,"Just fuck around. Try stuff, and then try other stuff. Watch videos and then try that stuff.",comment,gi2kwcr,yosh_yosh_yosh_yosh,0,kpsh9v,,t1_gi1i7yv,5,0,0,,,,,
1609980407,[deleted],comment,gidaqys,[deleted],1,ks08hr,,t3_ks08hr,6,0,0,,,,,
1609983959,this is the funniest shit i have ever seen in all my years,comment,gidifcj,yosh_yosh_yosh_yosh,0,ks08hr,,t3_ks08hr,11,0,0,,,,,
1609993964,"Oh shit, I remember that thread... wonder if any of those comments are mine lol",comment,gie39md,kotoktet,0,ks08hr,,t3_ks08hr,4,0,0,,,,,
1609994660,Somebody forgot to take their risperidone .,comment,gie4jl0,Marcie_Childs,0,ks08hr,,t3_ks08hr,5,0,0,,,,,
1609994819,"""Ha ha. this is funny"" 

\*sees n-word\*

"".... yeah.""",comment,gie4u19,Marcie_Childs,0,kpo8g1,,t3_kpo8g1,4,0,0,,,,,
1609995368,Was so confused. Thought this was about trans men at first.,comment,gie5uwr,Marcie_Childs,0,kosibu,,t3_kosibu,5,0,0,,,,,
1609995512,"Wholesome post, but just reminded me that the longer I don't transition, the worse my life will be.",comment,gie6492,Marcie_Childs,0,kmppom,,t1_ghhijna,2,0,0,,,,,
1610000090,I almost didn’t want to post this because I thought that word would get me banned. Then I remembered that I’m thebonly mod in this group,comment,giedpaz,Fentanya,0,kpo8g1,,t1_gie4u19,5,0,0,Queen of this subreddit,,,,
1610028217,"On the other hand, it could also remind you that the best time to start addressing these feelings is always right now!",comment,gifbg6m,NotQuiteJessica,0,kmppom,,t1_gie6492,2,0,0,,,,,
1610048311,[deleted],comment,gigirtq,[deleted],1,ks08hr,,t3_ks08hr,1,0,0,,,,,
1610056317,I love this!,comment,gih0i5j,Fentanya,0,kslbf9,,t3_kslbf9,7,0,0,Queen of this subreddit,,,,
1610056658,[deleted],comment,gih18k1,[deleted],1,kslbf9,,t1_gih0i5j,5,0,0,,,,,
1610079878,[removed],comment,giiandc,[deleted],1,kslbf9,,t3_kslbf9,4,0,0,,,,,
1610083317,[deleted],comment,giig9xq,[deleted],1,kslbf9,,t1_giiandc,2,0,0,,,,,
1610215986,"&gt;I didn't start early (hrt at 21)  

I get it, I'm a hon, might as well kms",comment,giod4z2,SabrinaSorceress,0,kslbf9,,t3_kslbf9,8,0,0,,,,,
1610353869,bruh why you take a screenshot the length of the nile,comment,giuv9es,yosh_yosh_yosh_yosh,0,kuy2yq,,t3_kuy2yq,8,0,0,,,,,
1610357643,tranon is butterphobic,comment,giuztbo,TrueFun,0,kuy2yq,,t3_kuy2yq,7,0,0,,,,,
1610393545,"Nah, it's literally the most common result of transition. 

This is me, too, and I started at 22. I have fake boobs tho",comment,gix12d8,yosh_yosh_yosh_yosh,0,kslbf9,,t1_giiandc,7,0,0,,,,,
1610422037,"Honest answer, I don't use 4chan very often so I've no clue if I can make the reply shorter.",comment,giynkkv,FiveFiveOneTwo,0,kuy2yq,,t1_giuv9es,1,0,0,,,,,
1610430837,lmao just confess your feelings you absolute clown,comment,giz2ftg,Juuliyuh,0,kve9iw,,t3_kve9iw,9,0,0,racist femboy,,,,
1610499503,[removed],comment,gj2a3ve,[deleted],1,kvhrs6,,t3_kvhrs6,6,0,0,,,,,
1610570673,Telling him to ignore the safeword is way to dumb lmao,comment,gj5ia9m,Worm6974,0,kvhrs6,,t3_kvhrs6,3,0,0,,,,,
1610595542,its hot,comment,gj6wyxy,SilentFungus,0,kvhrs6,,t1_gj2a3ve,7,0,0,,,,,
1610631741,"pro-tip, what you do is you just drag your browser window smaller so all the text gets squished in like a phone screenshot",comment,gj85jve,SilentFungus,0,kuy2yq,,t1_giynkkv,1,0,0,,,,,
1610663967,Ah thanks &lt;3,comment,gja4cy4,FiveFiveOneTwo,0,kuy2yq,,t1_gj85jve,1,0,0,,,,,
1610665221,"Holy shit can I get insurance to cover my boob job too? Also, I’ve never understood why people like ch*ldren so much, those are all positive aspects to me.",comment,gja6vz3,Fentanya,0,kxeahq,,t3_kxeahq,14,0,0,Queen of this subreddit,,,,
1610666329,"Yeah absolutely, you might need to fight insurance for it though. I wasn't able to, but you can.",comment,gja92gl,yosh_yosh_yosh_yosh,0,kxeahq,,t1_gja6vz3,8,0,0,,,,,
1610669301,Tfw hrt made your boobs too small to be proportional but too big to get BA covered 😔,comment,gjaetwz,[deleted],0,kxeahq,,t1_gja92gl,7,0,0,,,,,
1610679784,just cut your e down for a while so your boobs deflate lo o l,comment,gjayqni,yosh_yosh_yosh_yosh,0,kxeahq,,t1_gjaetwz,4,0,0,,,,,
1610696821,Game the system,comment,gjbnymv,scorchdearth,0,kxeahq,,t1_gjayqni,3,0,0,,,,,
1610927115,Is Unchaser in every thread?,comment,gjnxgcy,Kalvin-TL,0,kzhvv2,,t3_kzhvv2,5,0,0,,,,,
1610928866,transbian culture truly is wild,comment,gjo0t5k,Juuliyuh,0,kzhvv2,,t3_kzhvv2,2,0,0,racist femboy,,,,
1610979457,i don't really get why some people have started flexing their ffs like that makes them more valid than others,comment,gjpz7fa,kotasdpx,0,kslbf9,,t3_kslbf9,4,0,0,,,,,
1610991069,[deleted],comment,gjqkxxn,[deleted],1,kslbf9,,t1_gjpz7fa,2,0,0,,,,,
1611148201,"~~that's pretty cute uwu~~

fuck my agp is showing",comment,gjxvdtg,wednesday--,0,l180mr,,t3_l180mr,11,0,0,boysmell connoisseur,,,,
1611153253,I'm worried about them,comment,gjy406o,scorchdearth,0,kvhrs6,,t3_kvhrs6,4,0,0,,,,,
1611164317,[deleted],comment,gjyrr20,[deleted],1,l180mr,,t3_l180mr,2,0,0,,,,,
1611186687,[removed],comment,gk05eux,[deleted],1,l180mr,,t3_l180mr,7,0,0,,,,,
1611441245,perhaps a different insurance provider might cover them,comment,gkghrbe,Fentanya,0,kxeahq,,t1_gjaetwz,1,0,0,Queen of this subreddit,,,,
1611445645,"That was a joke but my insurance did state something like you have to be a B cup after 2 years of HRT. I'm literally already a B cup after not even a year. I'm going to be switching insurance anyways so I'll see about that. It's also my 17th birthday soon so I can start getting consultations for stuff.

Hopefully my daddy will pay for his little ~~girl's~~ boys breast implants.",comment,gkgt1d3,[deleted],0,kxeahq,,t1_gkghrbe,2,0,0,,,,,
1611446934,[deleted],comment,gkgwc87,[deleted],1,l3nxnk,,t3_l3nxnk,-1,0,0,,,,,
1611447149,"Trans women must have absolutely no sexual impulse in order to be trans. Anything else is AGP. You can give me an example of literally any sexual thought, and I'll tell you how it's AGP.",comment,gkgwvw2,yosh_yosh_yosh_yosh,0,l3nzvy,,t3_l3nzvy,30,0,0,,,,,
1611447249,"Of course, only asexual trans women are valid.

I want to suck a huge cock from a Chad while being fucked. This has nothing to do with meta attraction. I am genuinely attracted to men.

Here. How is that AGP.",comment,gkgx4iw,[deleted],0,l3nzvy,,t1_gkgwvw2,12,0,0,,,,,
1611447462,"Hilariously, many blanchardians consider asexual trans women to be _especially_ AGP, because they interpret the purported lack of sexuality as them being sexually attracted to themselves (they already have a partner and that partner is their own AGP girlsona)",comment,gkgxnl5,omnibean,0,l3nzvy,,t1_gkgwvw2,25,0,0,🅱️oymoder,,,,
1611447869,Lots of women have rape fetishes.,comment,gkgyl0q,[deleted],0,kvhrs6,,t1_gj2a3ve,3,0,0,,,,,
1611447913,If you insert yourself into erotica then you are agp. Cis women never imagine themselves when reading erotica. Cis women only read for the plot! 😤,comment,gkgyon3,Pm_me_trans_goals,0,l3nzvy,,t3_l3nzvy,20,0,0,,,,,
1611448022,"God I hate Blanchard. Like maybe asexual trans people are lying and are actually so self obsessed that they can only get off to themselves like the dirty tranny they are. It’s not like some asexual people could also be trans. That’s absurd, otherwise how do I justify my theory that trans people are all sex perverts‽",comment,gkgyxtr,Pm_me_trans_goals,0,l3nzvy,,t1_gkgxnl5,19,0,0,,,,,
1611448127,Blanchard would be the ultimate 4chan poster.,comment,gkgz6eq,[deleted],0,l3nzvy,,t1_gkgyxtr,12,0,0,,,,,
1611448928,He really would be. Sometimes I think Blanchard was secretly a repressor who just really hated himself lol.,comment,gkh17i8,Pm_me_trans_goals,0,l3nzvy,,t1_gkgz6eq,11,0,0,,,,,
1611449158,"No shit, who else is more obsessed with trans people than trannies themselves?",comment,gkh1s6l,[deleted],0,l3nzvy,,t1_gkh17i8,10,0,0,,,,,
1611449356,He was either trans or a chaser. That much is certain lol,comment,gkh2969,Pm_me_trans_goals,0,l3nzvy,,t1_gkh1s6l,13,0,0,,,,,
1611451885,"My brain worms are too powerful for you, watch this:

You mention Chad because Chad is a hypermasculine symbol, you mention the size of the cock because it's also a hypermasculine symbol. The desire for hypermasculine symbols in your partners validates your feminine ideal. Meta attracted transsexuals often profess genuine attraction, but their professed genuine attraction is false and self-deceptive, and a desire for gestural femininity. \*

Meta attraction in denial bby, that was easy

\*all of this is immediately false as soon as you vehemently deny ever being attracted to women, because that's a dainty perfect pretty HSTS thing. No, that's not homophobic, what do you mean?",comment,gkh7tzd,yosh_yosh_yosh_yosh,0,l3nzvy,,t1_gkgx4iw,12,0,0,,,,,
1611452406,"I'm convinced that the vast majority of chasers are in-denial trannies, change my mind",comment,gkh92cv,yosh_yosh_yosh_yosh,0,l3nzvy,,t1_gkh2969,7,0,0,,,,,
1611453074,[removed],comment,gkhaio1,[deleted],1,l3nzvy,,t3_l3nzvy,7,0,0,,,,,
1611453234,"I'm 2 years on HRT and still masturbated to myself in the mirror just yesterday. I don't do it as often as I used to, but I am still kinda AGP, even if I like men. I masturbate almost every time I get an erection. Pre-transition, this meant every day, these days, it's like every two weeks or so.",comment,gkhauyy,Fentanya,0,l3nzvy,,t3_l3nzvy,4,0,0,Queen of this subreddit,,,,
1611453551,This is proof of spiro's ineffectiveness,comment,gkhbjk5,[deleted],0,l3nzvy,,t1_gkhauyy,6,0,0,,,,,
1611453761,[removed],comment,gkhbzlq,[deleted],1,l3nzvy,,t1_gkhbjk5,1,0,0,,,,,
1611453808,"I mean, it did drastically reduce my libido",comment,gkhc3bs,Fentanya,0,l3nzvy,,t1_gkhbjk5,5,0,0,Queen of this subreddit,,,,
1611455088,\*cypro still better\*,comment,gkheq3k,[deleted],0,l3nzvy,,t1_gkhc3bs,4,0,0,,,,,
1611462497,No wonder transbians are all so fucking wierd,comment,gkhsd1c,[deleted],0,l3nzvy,,t1_gkh92cv,8,0,0,,,,,
1611474833,"I mean, what’s exactly normal to you?🤔",comment,gkifbhe,Maoist_TransGirl,0,l3nxnk,,t1_gkgwc87,-2,0,0,,,,,
1611528307,wHy Are yOU DEnyInG SciEncE,comment,gkn6jks,winter-cherry,0,l48s2y,,t3_l48s2y,7,0,0,,,,,
1611530895,"whatever, fujoshi",comment,gkncklv,scorchdearth,0,l3nzvy,,t1_gkhaio1,3,0,0,,,,,
1611530911,[removed],comment,gknclu6,[deleted],1,l3nzvy,,t1_gkncklv,2,0,0,,,,,
1611543871,[removed],comment,gko2edr,[deleted],1,l48s2y,,t3_l48s2y,9,0,0,,,,,
